,Title,Content
13,IRE 2023: what equipment will be on show?,"Since the last edition of the International Rental Exhibition (IRE), it would be an understatement to say that plenty of innovation has taken place among manufacturers, driven by the demand for compact equipment, alternative power and environmentally friendly solutions.
The show will bring an array of those OEMs together under one roof to display just some of the latest launches and developments in construction equipment and technology, as well as aerial platforms through the APEX show, which is being held in conjunction with IRE.
With a wide range of equipment on show - more than 200 companies combined are exhibiting at IRE and APEX - here is a preview of what visitors can expect to see at IRE 2023.
The role of sustainability and low-emission equipment has continued to increase in recent years, and that theme will be highlighted at IRE as Sany will show the electrically driven SY19E mini excavator.
The machine, which the company says delivers zero pollutant emissions and significantly lower noise levels, comes with an electric motor that delivers a peak output of 15kW and an accumulator pack that lasts for an entire working day on one battery charge.
Charging the machine is made possible with a fast-charging station via DC in 1.5 hours, at a public AC charging station in 2.5 hours or overnight at a 220V socket.
Case Construction will highlight its CX15 EV 1.3 tonne mini excavator. Powered by a 16kW electric motor, the machine features retractable tracks that reduces machine width to 790mm and a load-sensing hydraulic system that is said to allow the operator to dial the machine into each task.
The 21.5kWh lithium-ion battery is charged either by the 110V/220V on-board charger or via an external rapid charger that can fully charge the machine in 90 minutes and can last up to an entire working day depending on the work, while its minimum swing radius design is said to make working close to structures and obstacles easier.
From its range of electric and low-emission machines, Yanmar will display several future-ready machines at IRE.
First up is the SV17e electric mini excavator prototype. Designed for the 1.5 to 2.0 tonnes segment, the unit is powered by an all-electric drive and has an open-centre hydraulic system with load-sensing hydraulic pump.
The SV17e delivers 23.5kWh gross electric power, while its 48V air-cooled motors provides “impressive digging, lifting and carrying capabilities,” according to Yanmar.
Another Yanmar prototype on show will be the V8e electric compact wheel loader with 40kWh battery capacity, hydrostatic drive and high-lifting capabilities.
The machine has an 800l loading bucket, 11kW charging in standard configuration and 22kW in optional fast charging.
Joining the SV17e and V8e is the C08e tracked carrier and ViO33 zero tail swing excavator.
With an 11.5kWh battery and a power capacity of 24V, Yanmar says the compact C08e has the “ultimate power and manoeuvrability to excel in tight spaces,” while the ViO33 is said to offer “true zero tail swing” and an “ultra-quiet and efficient engine” designed with low emissions in mind.
Launched in 2020, the eDingo 500 electric compact utility loader from Toro will make its European tradeshow debut at IRE having undergone several upgrades over the last three year’s.
An electric version of the Dingo 323, the machine produces zero engine-exhaust emissions and less noise thanks to its HyperCell Power System, a new lithium-ion battery system developed by Toro.
Part of the Tobrocco Giant stand will be formed of the latest additions to its e-range of compact wheel loaders.
The G2200E, an electric version of the G2700, and the G2200E X-TRA are both equipped with a 48V LPT-battery that can be charged at a car loading station. An external high frequency charger with 48V/150A of 48V/300 can also be used to charge the machine.
Said to be ideal for rental due to the low service weight, the wheel loaders have a pulling force of 12.500N.
In addition to the compact loaders, Tobrocco says it will also introduce the GP1950E electric vibratory plate and the GR740E vibratory rammer.
JCB will show its latest innovations in zero-emissions technology and demonstrate its role in the move towards a cleaner, low-emission future for construction and rental equipment with its growing range of JCB E-TECH electric machinery.
The JCB 19C-1E - the world’s first electric mini excavator will take centre stage, the company say.
The machine is said to produce zero exhaust emissions at point of use and is “considerably quieter” than a standard machine.
Four lithium-ion batteries provide 20kWh of energy storage – enough for full working shift for many mini excavator customers on a single charge.
Also new will be a 2 tonne capacity E2000 electric site dumper from HG Machines in Denmark. This machine follows on from the ultra-compact 1 tonne capacity machines launched by the company in 2016. See more on this machinehere.
The newly launched Archy rental platform from Gorman-Rupp Europe will be officially launched into the international market at IRE.
The platform aims to deliver “faster, easier and more reliable” pump rental by using a 10-step pump selector that can advise which pump is needed for specific projects.
It then suggests which pump will be ideal for the user and details how to reserve, rent and manage the pumps as well as all the rental pricing.
Gorman-Rupp say 100s of pumps will be available on the tool, including booster pumps, centrifugal pumps, diaphragm pumps, high pressure centrifugal pumps, pump hoses and submersible pumps.
Another new launch on show at IRE will be the Task Manager web application from Volvo CE. The worksite management tool, which is currently available in the North American market, is designed to connect people, machines and projects to ensure activities are delivered “on target, on time and to budget,” according to Volvo CE.
Swepac will show a line-up of reversible plates it is launching as part of its Battery One concept range.
The FB200B has a 4.6kWh onboard battery, 3.0kW IPM synchronous motor, 550mm wide base plate, while the larger FB300B has a 6.6kWh onboard battery, 10.0kW IPM synchronous motor and 600mm wide base plate.
The large onboard batteries enable them to reach sufficient running time without re-charging.
Users can monitor the progress of projects, set targets, track material on sites and manage data from mixed fleets in real-time. The data collected by Task Manager is then made accessible via mobile or laptop.
Spartan Solutions will debut its PHALANX V6 software platform that aims to streamline the process of equipment rental operations.
The platform utilises artificial intelligence (AI), expert rules and statistical algorithms to identify patterns and trends in equipment’s telematics and operations data. This data includes information about the performance, operation, maintenance, and usage of a machine.
Once the data is collected, the AI engine can detect any abnormalities or issues.
Launched at Bauma 2022, the HBOX+ Hybrid lighting tower will be presented by Himoinsa.
The tower combines a battery-powered system and Stage V diesel engine that is said to reduce noise and carbon footprint while keeping the 120,000-lumen light capacity of its diesel counterpart.
The HBOX+ Hybrid includes LFP batteries (Lithium Phosphate) that have been designed for a lifetime of 6000 cycles, while also offering four different working modes.
The HBOX+ Hybrid incorporates 4 x 350W LED spotlights and an LED Dimming Control which means the tower can start-up with dimming.
Himoinsa will also demonstrate the 45/60 model (60kW/h) of its EHR battery-powered generator which comes with its HICORE System.
Described as a compact, clean product, the generator can operate as a single source of power generation for as a recharging station for electrical construction machinery, as well as allowing integration with gas and diesel generator sets.
Vistors to the Briggs & Stratton stand will be able to see its newest Vanguard battery products and engine solutions.
The products on display include the Vanguard Si 1.5kWh Swappable Battery and the new Vanguard 400 EFI /ETC Single Cylinder (pictured).
The company says it developed the cylinder by working with OEMs to provide a “tailored power solution, that caters to each OEM’s specific requirements within the rental market.”
Generac Mobile will display the VT-Solar, a generator-free lighting tower with three solar panels that can recharge its built-in battery pack.
The tower is available in two versions, a manual-mast and hydraulic-mast version, which comes with higher battery capacity, powerful solar panels (400W each) and four LED floodlights with adjustable light power.
Exhibiting alongside Generac Mobile, Pramac will display its GRW Hybrid generator, which it describes as an efficient, reliable unit that reduces operational expenditure, with a choice of available operating modes that allow the correct selection according to site specifications.
Trime will present the X-SOLAR 4x60W LED lighting tower fitted with four 60W LED lamps.
The company says it is built to be robust, with galvanised metal works, and powder coating finish.
The zero-emission tower also has optional features, including a telemetry system for remote location and operational monitoring, an automatic start-up PIR operation, and dimmable lighting.
Elsehwere, ItalTower will exhibit its Street Solar lighting tower that it launched last year.
The tower with a 60W solar panel produces 6,000 lumens and has a lithium battery pack with a capacity of 14.8V.
Paclite will display its concept edging trowel, the M600.
Powered by a Vanguard engine, the new concept 600mm machine has been developed together with Cramo Sweden and is said to be ideal for rental due to its ABS fly wheel, which ensures concrete does not stick to the trowel.
Paclite says it will launch new versions of the M900 and M600 later this year, powered by a long-lasting battery-charger & motor.
Taking place from 6-8 June, IRE will be held at the MECC centre in Maastricht, the Netherlands, alongside APEX, the European Rental Association’s (ERA) annual Convention and the European Rental Awards. Visit theIRE websitefor more information on the show. For information on how to arrive at the MECC centre,click here."
14,Why Develon and Hyundai CE believe compact equipment can take them into top 5 OEMs,"
It’s a tall order to break into the top 5 construction equipment OEMs.

In fact, it would take sales of around US$11 billion, according to last year’s Yellow Table,International Construction’sranking of the top manufacturers by revenue.

Nonetheless, that’s the goal of Hyundai Genuine, the holding company ofHyundai Construction Equipment (Hyundai CE)and what used to be Doosan Infracore and is nowDevelon.

Talking toInternational Constructionat ConExpo 2023, Seunghyun Oh, CEO of Develon and Albert (Seunghyun) Roh, product director for Develon in Europe explain the thinking behind their ambitious targets.

Hyundai Genuine has a balancing act to perform; its Develon and Hyundai CE brands need to look and feel sufficiently different from each other but also make use of shared resources.
One of the ways that the resources of the two companies is being leveraged is though research and development (R&D).
They are working together, where appropriate, to develop new technologies and to save on costs. It is one way that Hyundai Genuine can increase its global sales and push closer to the world’s biggest OEMs.
“We essentially reorganised the R&D engineers, the research engineers, let them move into Hyundai Genuine where they are going to develop a base technology for autonomy and electrification,” explains Roh.
“The two companies are separate but Hyundai Genuine, the holding company, leads on some of the advanced technology and the two sister companies are developing our existing products. We need to differentiate each product for each brand. But internally we are trying to get some synergy, particularly in R&D, procurement, and even in production.”
But the two executives also clearly believe that there are opportunities in markets and product segments that haven’t been attacked aggressively before.
“We are targeting the global top five in the whole construction equipment industry. If I look into our current business performance product-wise, in excavators – such as crawler, wheeled and heavy excavator – we are seeing quite good results,” says Roh.
“However, when it comes to compact equipment, due to the history with Bobcat and Doosan, we haven’t invested as much as we could in the compact business. From now on we are trying to invest more in the compact business to get more volume.
“At the same time, we are also seeking some opportunity in the wheel-based product, such as wheel loader or articulated dump trucks.”
The company has recently added bulldozers to its product line up, something which the dealers are said to be very happy about.
That’s the product side explained – what about different markets?
“We are trying to invest more in the advanced market to become a real global top player,” says Roh.
The CEO, Oh, adds, “We need to invest more in the North American market because the current presence is very low in terms of market share.”
When it comes to R&D the two main areas of focus are electrification and automation. Develon has already produced a two-tonne electric excavator and has plans to produce other models in this range – in our conversation they say that electrification is, “truly a mega trend for the future,” and that the company will, “develop quickly all lines of electric mini excavators.” There are also initial plans to produce a larger electric excavator of up to 20 tonnes.
But the plans for new technology are larger and more ambitious thanjustautonomy and electrification; the company wants to help the whole of the construction site to be managed more efficiently, to be a solutions provider. XiteCloud, which was first announced in 2020, is now taking its first steps towards commercialisation and is part of the company’s Concept-X.
Concept-X is an integrated unmanned and automated control solution, first demonstrated to the world in 2019.
This has developed into Concept-X2 which combines ICT (Information and Communications Technology) and AI (Artificial Intelligence) technologies at the construction site. There will come a time – perhaps in the near future – where this isn’t a concept anymore.
“At the moment we are willing to develop continuously and upgrade the Concept-X. Now we have a version one and version two; maybe in three years, we can develop more realistic products for Concept- X.
“I am saying not only Concept-X; we will say product X. We will move to some real product not at the concept stage, that’s the plan.”
As well as the development of Concept-X into a something that is commercially available, Oh says that in the next few years the company may develop not just new compact equipment but also even bigger equipment, such as at the top end of the size and weight scale when it comes to excavators and dump trucks.
If the company doesn’t make their global top five ambitions, then it certainly won’t be for lack of effort.


It was at the Las Vegas show that the Develon brand (formerly Doosan) officially unveiled its new products.
“We had many ideas regarding the new brand name. But we selected Develon; it is the combination of two words: develop and onwards. We will continuously develop a better product for customers and develop better solutions for smart construction,” comments Oh.
Every machine that is produced from ConExpo onwards will be under the Develon name and branding. However, they revealed that for equipment that has been produced in 2023 but before the event the company will, “support some rebranding for the existing machine at the dealers yard” but that the policy differs from country to country."
15,All terrain crane donated by Tadano in aftermath of earthquake,"


Crane manufacturer Tadano has donated an all terrain wheeled mobile crane to help with reconstruction work following the devastating Turkey-Syria earthquake.
On 6 February 2023, the enormous earthquake hit near the border between southern Turkey and Syria. More than 50,000 people were killed.
“We would like to express our heartfelt sympathy to those affected by the disaster and our appreciation to all those who are working hard for recovery and reconstruction,” the company said.
Tadano donated a 50 tonne capacity ATF 50G-3 all terrain crane with 40 metre lifting height to the Turkish government. It will be used to help in the ongoing recovery and reconstruction efforts in the affected areas. The three axle model will be delivered via Istanbul-based Tadano distributor ENKA Pazarlama Ihracat Ithalat.
The ATF 50G-3 is designed to cope with the rough roads expected in the disaster-stricken area. It is a small and manoeuvrable crane, Tadano said, and “we believe that this crane will make a wide contribution to the ongoing restoration and reconstruction of the affected areas.”
Delivery of the crane to Turkey is scheduled on or around 24 April 2023.
"
16,Tenfold production increase for LGMG Europe,"LGMG Europe has officially opened its new production facility in the Netherlands, marking the occasion with an opening ceremony that was attended by both its business partners and customers.
Said to be 10 times bigger than the company’s previous site in Spijkenisse, the new plant will allow the company to increase the speed and efficiency of its manufacturing processes.
Guests attending the opening event were treated to a tour of the new facility, which LGMG Europe has spent the past five months renovating. The site includes offices, a state-of-the-art training centre and a full spare parts warehouse.
LGMG, which is due to introduce 10 new equipment models to its product portfolio later this year, said a new ERP (enterprise resources planning) system had also been implemented. This will enable the company to increase the availability of finished products and spare parts, and provide a faster response times and services.
The opening ceremony was co-hosted by LGMG Sales Director of Europe, Vincent Vercaemst and Ares Song, General Manager of LGMG MEWPS, who just a few weeks ago revealed that the subsidiary’s sister company, LGMG Mexico, would begin producing boom and scissor lifts in the second half of this year following the opening of its new US$140 million facility in Monterrey.
The Mexico plant and an overall restructuring of its operations in the US are in response to theU.S. Department of Commerce and International Trade Commission’s rulings in late 2021that imposed high import tariffs on LGMG’s products entering the US market.
"
