,Title,Content
9,Online exclusive: Rokbak investigates electric and hydrogen-powered articulated trucks,"The idea of articulated trucks that can carry a payload of 30 tonnes being powered by electric power might seem far fetched but it is a possibility that the company Rokbak is looking into. Paul Douglas, Managing Director of the articulated truck company – which is part of the Volvo group – says that they are investigating all possibilities.

“Our trucks will have to be zero emissions somehow. The question is: what does that look like?” comments Douglas. “Electrification using battery technology that you can see today is a stretch for these big products because these are big power demand for long hours of usage.”
As Douglas says, electric power probably isn’t the best source for trucks due to how large they are and their work cycles – it isn’t uncommon for trucks to be run for 20 or 22 hours a day. “We are looking at hydrogen internal combustion engine and fuel cells to provide the electricity using hydrogen. These are technologies that Volvo is working with on their own highway truck and bus solutions.”
Douglas is originally an engineer and the challenges of cutting emissions and alternative power sources clearly excites him. He makes the point that, with technology developing at a rapid rate, no one in the construction industry can confidently state what the future will hold for power.
“It is easier to electrify the smaller stuff,” he says. “But there’s a lot of learning that comes from that. And you know, I can’t keep up with battery technology. It’s moving so quickly. Every six months battery capabilities seem to grow almost exponentially. I don’t know where it will all end up, but I think it’ll be a combination; some products will be batteries, some will be hydrogen fuel cells, and some will be hydrogen internal combustion.”
The last 18 months have been a boom time for both rigid and articulated haulers with numbers the highest they have been for around a decade at around 9,000 units a year. Part of this is due to pent up demand that followed the Covid-19 pandemic added to governments around the world investing in large infrastructure projects although Douglas believes that this is likely the peak of the market.
“We all felt at 8,000 units worldwide, that would be the peak. Then we said the same thing at 8,500, but now we are over 9,000 units. When I look around specific markets, we can see the slowdown coming, such as in Europe. I think we’re probably at the peak now. How long will that hold? Most of 2023 will probably level out [at current levels] although we could start to see a downturn in the second half of the year. It’s very strong at the moment, so we need to capitalise on that as much as we can.”
One of the markets that has driven this growth is North America, which Douglas says accounts for over half of Rokbak’s sales. In terms of smaller markets that have seen good growth he highlights Indonesia and the UK where the HS2 high-speed train project has played a key role in generating demand.
The brand of Rokbak has been around now for around 18 months following the name change from Terex Trucks. Douglas says that a huge effort went into this and that the response from the industry has been very positive. “The reception of it has been fantastic, first and foremost with our own dealer network because we were asking them to move from the old name to Rokbak. But they’ve gone with it, they’ve got a positive feel about it, they’ve invested into. The attraction that we’re getting from people that want to be on this journey with this, inquiries about becoming our dealer, has been really good.”
Talking about the dealer network, the change that we spoke about at the start of this article, from diesel powered trucks to alternative powered trucks, will impact dealers in more ways than one. First, they will be selling a different product and secondly there are different demands and opportunities with this.
“Your dealer partners, the people that sell and support the product – this is going to be a new adventure for them as well,” he says. “It’s new technology for them. An electric drive product probably gets less wear parts, less servicing and spares opportunity. That’s going be a real challenge for the traditional dealer. Their business model’s going to have to evolve.”
Equipment manufacturers have reduced emissions to meet different standards around the world and are now investing heavily into the R&D of alternative power sources, all while juggling issues such as rising inflation and a lack of skilled workers. It is a challenge, but Douglas gives off the sense that he wouldn’t have it any other way.
“Moving into this new technology, new manufacturing processes are going to be required, new dealer models. There’s a real change, you can feel it in the air,” he says, pausing for breath before adding with a smile, “It’s fascinating.”"
10,APEX 2023: a guide to what’s new at Maastricht show,"Unsurprisingly, green energy and digitization will be two focuses of the world’s largest dedicated exhibition for access equipment, taking place in June this year. Manufacturers will be out in force and here follows just a few examples of those.
Dinolift will be addressing all these, alongside electrification and sustainably, by promoting its MyDino telematics software at the show that will partly be demonstrated via mobile phone and tablet.
MyDino comes standard on all units, including the 280 RXTE lightweight boom lift pictured here, introduced from January.
The Finish manufacturer is also supporting the European green target of reducing carbon dioxide emissions, with its the lithium version of its 280 RXTE model, launched last year.
Also, there will be the 23m working height 230 VTH chassis mounted unit, while trailer mounts will be represented by the 160XTB II.
Faresin will attend APEX for the first time and present the 6.26 Full Electric and 17.45 Classic 55 telehandlers.
Electrification will be one of the most important themes on the Faresin stand. The 6.26 Full Electric was launched in 2018 as the first electric telehandler in the world and has since then gone on to considerable success and updated versions.
Designed to be agile, quiet and sustainable, the 6.26 has a 2.6 tonne lifting capacity and a maximum height reach of 6m.
Created as a twin to the diesel-powered version, the full electric unit is suited to construction sites at night, zero-emission residential areas, livestock farms, greenhouses and food handling areas, such as cold rooms, wine cellars and food laboratories.
The 17.45 Classic 55 of the Big Range is created for greater heights, with a three-section boom for a maximum lifting height of 17 meters and a maximum load capacity of 4.5 tonnes.
XCMG will display eight models, including electric telescopic units and an electric 18m rough terrain scissor lift, among others.
It is worth mentioning that the XG1823ERT RT scissor and XGS28ACK telescopic boom are being introduced to Europe for the first time.
The electric XG1823ERT has a maximum working height of 18m with a large rated load of 700kg. The also electric XGS28ACK has a capacity of 460kg and the maximum operating height of 28.8m.
The telescopic XGS58E1 will also be at the exhibition. The super-large 58.6m working height model with 24.8m outreach, is a newly upgraded version of the pre-existing model of the same name. It has a 230kg/450kg dual load capacity.

WHEN:6- 8 June, 2023
WHERE:MECC Exhibition Centre Maastricht, The Netherlands
Apex, the world’s largest dedicated access equipment show, will take place in Maastricht, The Netherlands, in June of this year.
In situ alongside the International Rental Exhibition (IRE), at the MECC Exhibition Centre, APEX will showcase the cutting edge of access industry technology and trends.
To find out more, or to bookFREEtickets, visit:www.apexshow.com
Falcon Lifts will present the new 38m working height Falcon 380XL Vario, with key features including a new XL-sized basket with dual entry and enhanced capacity of 450kg.
There is a panel carrier and lifting brackets for telecom mast equipment. The panel carrier allows operators to place material outside the platform, such as glass panels, solar panels, plywood and other materials in panels up to 100kg. In addition, there is a new storage compartment for safety gear.

The machine boasts a compact design and low weight of 8250kg, which keeps ground pressure low, while the tracks are height and width adjustable.
As standard, dual power comes from a Stage V Kubota diesel engine and chargeable battery.
Tracked manufacturer Easy Lift will present a new winch, available for all models from 24m to 53m, with different lifting capacities, on the RA24 tracked platform. This optional accessory makes the machine a real crane with a capacity up to 230kg.
In addition to the RA24 with winch, units from the small range will be at the show, including the R130 and R180 and the RA31HY.
The R130 and R180 spiders are among the best-selling models in the range thanks to their versatility and compactness, which allows them to be easily transported on trailers and driven through narrow spaces.
The R180, pictured here, reaches a working height of 17.6m, has an outreach of 8.5 m with a 120kg load in the basket and has an up and over clearance of 5.30m. Jib rotation is 90° and basket rotation is 180°.
The machine is 0.89m wide, 5.57m long and 1.95m high. The R130, the R180 is available with standard petrol engine combined with electric motor, or with the optional diesel engine or in the BA 48V - 100 Ah battery version.
See the full APEX Show guide in the upcoming May-June issue of AI.
"
11,Small but mighty: The role of mini and midi excavators in modern projects,"Many manufacturers in the construction industry, certainly the larger ones, have expansive product ranges. One of the reasons for this is financial – the more products a company can sell and service the more money can be made – but another one is simple necessity; construction is such a broad industry that it requires a wide selection of equipment.
Out of all the equipment that is used in construction it is difficult to think of one that has grown in popularity quite as quickly as compact excavators such as the mini excavator (machines approximately 0-6 tonnes) and the midi (approximately 6-10 tonnes).
“The first mini excavators were produced in Japan in the late 1960s and early 1970s as a tool of necessity in the country’s famously dense and crowded cities,” explains Chris Sleight, managing director, Off-Highway Research. “By the 1980s they were being exported to Europe and North America, but it was not until the early 1990s when Japanese asset prices collapsed and the economy stagnated that these overseas markets became much more important to the sector’s (still predominantly) Japanese suppliers.”
By the late 1990s, Europe had overtaken Japan as the world’s largest mini excavator market, while demand in North America was matching that of Japan by the mid-2000s. However, it was not until around 15 years ago that the popularity of mini excavators became truly established.
“The previous peak in sales was in 2007, just prior to the impacts of the Lehman Bros. collapse and global economic crisis. That year saw just under 185,000 mini excavators sold worldwide. Fast forward to 2021, the latest peak in the mini excavator cycle, and more than 325,000 units were sold,” says Sleight.
Two key factors have driven this growth: compact excavators have increasingly replaced traditional machine types like the backhoe loader in Europe and North America thanks to the attraction of a smaller footprint, full 360-degree slewing and lower prices than backhoe loaders; they have also started to sell in significant numbers in emerging countries. The most notable has been China, where the mini excavator market peaked at more than 100,000 machines sold in 2020.
Timur Abied, utility product manager at Volvo Construction Equipment (Volvo CE) tells International Construction that mini and midi excavators are among the OEMs fastest growing product segments with more efficient governance of energy being a main driver.
This sentiment is backed up by Cédric Durand, product management director EMEA, Yanmar Compact Equipment, who says that mini and midi excavators have been growing strongly over the past years.
He adds that, “From one year to another the growth can differ from one country to the other but almost all countries had a strong growth.”
Another smaller factor – but still important – behind the growth in the popularity of these machines is the increased use of attachments such as tiltrotators. “The growing popularity of tiltrotators has been a gamechanger for compact excavators, as tiltrotators allow an excavator operator to tilt and twirl an attachment 360 degrees,” says David Caldwell, national product manager, Takeuchi-US.
New technology is increasingly being integrated into mini and midi excavators, often from what was originally reserved for larger models. Stephane Dieu, excavators product manager, Europe, Develon (previously Doosan), says that, “With the arrival of our DX-7 range, all of the new mini excavators in the range are now equipped with our DoosanConnect telematics system, which was restricted in the past to only our medium and heavy segments – 14 tonne and over in the excavators. This gives our customers the opportunity to fully monitor their compact fleet.”
Chris Bardas, product manager, Hitachi Construction Machinery, reveals that the OEM’s latest mini and compact excavator are, “equipped with ICT solutions, safety features such as rear- and side-view cameras, and benefit from the Zaxis-6 cab, which is renowned for being highly comfortable and spacious, with an ergonomic seat and user-friendly controls.”
Wacker Neuson’s Klaus Allerstorfer, product manager, excavators, agrees that, increasingly, features are being added to mini and midi excavators that in the past were only for bigger models.
“Overall, more and more features are now being integrated into smaller models that were previously only used in larger models,” he explains.
“By features, I don’t just mean hardware, but also digital and data-driven solutions. One example is our EquipCare telematics solution, which makes it easier for our customers to manage their fleets and keep track of the condition of their machines.”
Electric powered equipment is a major trend in construction, especially in compact machines such as mini and midi excavators which many believe are more suited to this type of power than larger machines.
As is the case with many OEMs, Hitachi Construction Machinery has recently launched new electric models in this segment (ZX55U-6EB mini and ZX85-6EB compact) as has Takeuchi, with the all-electric TB20e.
Caterpillar, the world’s largest OEM, announced last year that its construction industries division was working on four new electric equipment machines, including the 301.9 Electric Mini Excavator powered by a Cat 48V, 32kWh battery with a run time of up to eight hours on a single charge.
Another new electric model is Bobcat’s 2-tonne mini-excavator the E19e – an electric version of the E19 internal-combustion model. It offers zero emissions, low-noise operation and comparable levels of performance to its diesel-powered counterpart.
The Bobcat E19e features the same profile and external dimensions. It features a 3.5-hour battery capacity and can be recharged quickly using a super-fast charger, meaning that, by topping up the power during work breaks, the machine can be used all day for the majority of typical applications.
Scott Park, Doosan Bobcat CEO, commented, “With the introduction of the E19e, Bobcat has expanded its larger-size electric line-up of zero emission and quiet machines that can match the excellent performance of our conventional models.”
Volvo CE has been at the centre of the development of electric powered construction equipment, with the OEM introducing its first electric compact models back in 2019 and now offering three compact electric excavators and two compact wheeled loaders. Volvo CE’s Abied says that the company are not just looking at compact equipment though, adding that, “While we started with electric mini excavators, we have also grown into the development of mid-size solutions such as our EC230 Electric excavator.”
While larger excavators may be increasingly electrified in the future, the focus is clearly on compact equipment such as mini and midi excavators.
A key point that OEMs make is that, as well as the benefits of electric power such as no emissions, no noise, no vibrations (thus a more comfortable environment for the operator), one thing is key: performance is just as good, if not better, than with diesel models.
Bardas from Hitachi sums it up by saying, “One of the main advantages of our zero-emission mini and compact excavators, the ZX55U-6EB and ZX85U-6EB, is the high level of performance they provide. No compromises have been made in terms of performance and they have been designed to provide similar levels of performance as diesel alternatives. The fact that they are zero-emission and quieter than diesel models are additional benefits.”
Despite all of the benefits that electric power brings, there are also challenges. Arguably the biggest one is the bottom line. To put it simply, electric machines are considerably more expensive than their diesel counterparts.
“When it comes to battery-powered solutions, the purchase price can be a hurdle,” admits Allerstorfer from Wacker Neuson. “But if you look at the total cost of ownership, the e-machines score with very low maintenance and operating costs, which in turn convinces many customers. In addition, we have found that renting the machines can help to quickly overcome initial doubts.”
Durand from Yanmar agrees that the higher cost is putting off some, but also makes the point that the total cost of ownership over the life of the machine can be less. “Indeed, the purchase cost is still higher than with traditional ICE machines. In the long run this price premium should decrease, and we are looking into the total cost of ownership as well which, at the end, is certainly the best criteria for profitability,” he says.
Another issue is undoubtably with charging and infrastructure. If construction is taking place on a remote site and not in a city then there may not be a power source to charge the battery. At the moment there are no universal standards regarding charging hardware and protocols.
“The lack of charging infrastructure and the still slower pace of introduction is a challenge and we need all stakeholders to help deliver the ecosystem required to support our electric machines and, in doing so, together achieve the strategic objectives of the Paris Agreement,” says Volvo CE’s Abied.
“High energy costs and the lack of financial and legal incentives also hamper deployment of strategic initiatives supporting electric power as the competitive solution for mini and midi excavators.”
When it comes to charging solutions increasing numbers of companies are producing fast charging options and there are other options, such as Wacker Neuson’s ‘charging box’.
“We are not only focusing on the development of zero emission products, but are also looking at entire construction site solutions,” says Allerstorfer.
“We will soon be launching our Charging Box, a mobile power bank for the construction site. This will enable customers to charge their zero emission products easily – and above all independently from local power sources.”
While electric mini and midi excavators are growing in popularity, the number of models sold are very small compared to diesel models. So, what’s next for these diesel models? More new technology being integrated into them that makes the life of an operator easier, and was previously reserved for larger machines, is one trend that will continue.
“These newer technological features all have one thing in common – they’re designed to help operators stay comfortable and more productive,” says Caldwell from Takeuchi US.
“They also help ensure that operators know exactly how their machines are performing by providing a great deal of information at their fingertips.”
In Wacker Neuson’s newest excavator, the wheeled EW100, Allerstorfer says that, “Digitisation played a major role in the development of this machine. For example, we have implemented an intelligent attachment management, a state-of-the-art Human-Machine-Interface, and the preparation for various assistance systems for process optimisation.”
Regarding sales around the world, mini and midi excavators are expected to continue to see strong numbers, if perhaps not at the same levels as in recent years.
Mini excavators are machines which replace manual labour. With the economic driver of rising labour costs (plus the difficulty in finding workers ) added to the fact that the purchase cost for these machines is cheaper than ever, adoption will continue.
“Drivers like these are at play in emerging markets, and the large-scale mini excavator industry which has sprung up in China means that machines are more affordable now than they were before,” says Off Highway Research’s Sleight. “This will help drive the adoption of this type of compact equipment around the world in the years to come.”
It will be interesting to see just what technology and power sources these mini and midi excavators of the future are equipped with as standard."
12,"Second 3,000 tonne capacity Huisman giant crane for Havfram","
Havfram Wind has ordered its second 3,000 tonnes-plus capacity Huisman crane for offshore wind turbine installation.
Dutch crane and heavy engineering specialist Huisman will supply the Norwegian installation contractor with the giant leg encircling crane (LEC). Installation will be on the second new NG-20000X wind turbine installation vessel. This order follows the first, placed in mid-December 2022, for an identical crane which was the 13th LEC order for Huisman since 2021.
At the same time, Havfram ordered the second new NG-20000X vessel, on which the crane will be installed, from CIMC Raffles in China. It is designed by GustoMSC in the Netherlands and CIMC Raffles. The new vessels with their 3,000 tonne LECs will be able to install turbines with rotors up to 300 metres in diameter and monopile foundations weighing 3,000 tonnes to a water depth of 70 metres.
Huisman’s fully electric LECs for Havfram will have 155 metre booms and a lifting height around 180 metres above the deck. It is designed to be lightweight and reliable, with high positioning accuracy and energy efficiency in operation. Deck space is maximised by the short tail swing design. Its segmented slew bearing is designed for easy inspection and maintenance.
Speaking about the latest order David Roodenburg, Huisman CEO, said, “We are grateful that Havfram have placed their trust in us to also equip their second innovative new build vessel with a Huisman crane. They are constructing some of the world’s most energy efficient, hybrid-powered wind turbine installation vessels. We are proud that with the two crane orders, we can contribute to boosting wind energy production as well as further improving energy efficiency to reduce Havfram’s carbon footprint.”
Commenting on his choice of crane Håkon Johannessen, Havfram Wind engineering manager, said, “We are pleased to have Huisman supplying cranes for our newbuild wind turbine installation vessels. Huisman’s track record and willingness to tailor their already proven leg encircling crane design to fit the requirements of Havfram and the market has been key to ensuring we have the right tool for the tasks that lie ahead.”
Like the first unit this second crane will be built at the Huisman factory in Zhangzhou, China.
"
