,Title,Content
0,Why America *is* ready for electric construction equipment,"
North America is ready for electric construction equipment, contrary to perceptions in some quarters that appetite for the machines lags that in Europe.
That’s according to Stephen Roy, president of Volvo Construction Equipment, Americas, speaking to International Construction.
Roy said he was seeing pockets of demand for electric machines across the USA, and that it wasn’t just their lower carbon emissions that was generating interest but the lower levels of noise and vibration.
When asked if electrically powered machines were likely to prove less popular in the North American market than in Europe, Roy said, “There are parts of the European market that are more progressive than other parts of the European market, so it’s not even the same in Europe and I think it’s the same here.
“We have states with high population density and when you go further towards the West Coast you get a lot more focus on environmental standards and more early adopters.”
Roy said he saw the trend to electrically powered machines continuing in the compact equipment market but also moving into the mid-range. Volvo is already piloting its first larger electrified excavator, the 22t EC230 in markets including Finland, Norway, South Korea, Sweden, and the machine is now making its way to North America.
“We have customers that are already ready to demo and get familiar with it and then we’ll start production for North America next year,” Roy said. “For the larger machines we see some alternative power solutions such as hydrogen fuel cells or hydrogen combustion engines”. The company already displayed a 30t prototype hydrogen fuel cell articulated hauler at ConExpo 2023 earlier this year.
Roy also highlighted the fact that certain customers are interested in the lower levels of noise and vibration that electric machines can offer, rather than just their sustainability credentials.
“It’s not just about emissions. A lot of our customers are really excited about low noise and no vibrations, which can lead to improved operator conditions and also improved safety. We didn’t lead with that but we are finding that it’s just as important and creates new opportunities,” he said.
And he pointed to some unusual examples of where electric machines have proved a success in North America. “We’ve sold compact machines in areas that I would never have thought we’d sell them.
“We laugh about this but the Toronto Zoo needed machines to work at the same time that the buffalos were there but the noise from diesel machines scared them away. We also have an example of a school system that wanted to do some repairs as they are expanding a facility but the work was right next to a classroom and so again the electric machine was more suitable because it was lower noise.”
Roy said that the shift Volvo anticipated taking place in the market meant that competencies among its own workforce also had to change. “We’ve had to go out and search for people that have backgrounds in software and electrical engineering. It’s definitely a new ballgame but it’s a positive in that it’s bringing people into Volvo that maybe wouldn’t have considered it before. Electric and sustainable power brings a whole new generation of people who want to be part of this transformation.”
Meanwhile, Roy, who is set tobecome president of Volvo-owned Mack Trucks next month, said that machine control technology in construction equipment “continues to get better and more sophisticated”.
He highlighted Volvo’s Dig Assist platform. “We now have a process where you can have an expert operator dig a hole for a certain application. So maybe you were putting in a culvert in a subdivision and you need to dig the hole in the same way. An expert can go out and dig it to the parameters that we need, save the file and transfer it to another excavator. And that excavator operator can now benefit from the best practice of the first, experienced operator.”
And he pointed to the growing capabilities of Volvo’s remote-controlled machines and its productivity tools.
The OEM recently handed over a remote-controlled EC250 excavator to a customer in South Dakota who works installing pipes in a water sewer.
He also noted that Volvo has the capability to retrofit non-Volvo machines and link them into Volvo’s Connected Maps feature, which allows a visual overview in real time of the position and movement of every machine, vehicle and visitor to site.
"
1,Develon launches new 6-tonne Stage V mini-excavators,"

Develon has launched the new DX62R-7 and DX63-7 6 tonne Stage V mini-excavators with a new shared global styling design.
The new mini-excavators are designed to offer maximum performance, optimum stability, increased versatility, enhanced operator comfort, controllability, durability, ease of maintenance and serviceability.

Both models are powered by the new D24 Stage V compliant diesel engine providing 44.3 kW (59.4 HP) of power. Develon says that despite offering an 8% increased torque of 26.5 kgm/rpm, the D24 engine still provides a 7% decrease in engine fuel consumption.


Moreover, the DX62R-7 and DX63-7 employ a Load Sensing System that operates on a new Main Control Valve. The mechanism enables a longer spool stroke, thereby enhancing controllability and work efficiency/performance in comparison to the previous models.
Both machines provide an auxiliary flow of 90 litres per minute, which improves the efficiency of work with attachments. The flow capacity can be easily monitored on the Develon Smart 8-inch touch screen in 10 increments and can be controlled using the thumbwheel located on the joystick.




The new cab on the DX62R-7 and DX63-7 features a full glass entry door to maximise operator visibility on this side of the machine from inside the cab. A rear-view camera is optional and the high luminance LED work lamps (which are standard) on the cab further enhance visibility and safety.








The mini-excavators include the latest Develon Fleet Management TMS 3.0 Cellular system installed as standard, which provides a telematics management system for the excavators, by collecting data from sensors on the machines."
2,‘Significant’ Q1 growth for Wacker Neuson Group,"But the company admitted that it does not expect to improve on these figures during the rest of the year.
The Germany-based company’s revenue climbed by almost 28% year-on-year to €667.2 million, while EBIT (earnings before interest and taxation) – aided by a one-off sale of fixed assets – more than doubled to €87.8 million.
The EBIT margin of 13.2% was also considerably higher than the 7.5% achieved in 2022.
“As anticipated in our annual guidance,we have carried the full momentum from previous quartersinto the new fiscal year andcontinued to grow significantly,” said Dr Karl Tragl, chairman of the executive board and CEO of the Wacker Neuson Group.
“At the same time, we continue to expect the first quarter to also be the strongest of 2023.” r
As in previous quarters, all three reporting regions contributed to growth in the first quarter with big increases.
In the Europe (EMEA) region, revenue rose by 22.4% €504 million compared to €411.6 million in 2022, with particularly positive growth in Germany.
On the product side, demand for excavators, wheeled loaders and telehandler increased noticeably.
The Americas region grew by 57% to €142.6 million, with a particular sharp year-on-year increase in the USA and further growth in Canada and South American markets.
Asia-Pacific region posted a lesser increase, by 7.3% to €20.6 million, driven primarily by the Australian market with products adapted to the needs of the local market and the focus on independent rental companies continuing to generate strong demand.
By contrast, the Chinese market continued to prove difficult and declined in the first quarter.
Speaking on supply chains after the group’s net working capital ratio fell from 31.9% to 30%, CFO Christian Burkhard said: “We are are still a long way from a normalisation of the situation.
“However, the continued increase in inventory levels paid off in the first quarter as we systematically exploited our growth opportunities. Nevertheless, it goes without saying that effective working capital management remains at the top of our agenda.”"
3,Back to the future at Metso as Outotec dropped from company name,"Metso merged with Outotec in the summer of 2020 and the combined business has since acquired companies including Tesab and McCloskey International.
Yesterday, the sustainable technology specialist announced operating profits of €197 million (US$217 million) for the first quarter of 2023 after a 22% year-on-year increase in sales revenue.
Metso Outotec’s Executive Team has been renamed as the Metso Leadership Team.
“After the successful integration of Metso and Outotec, we will focus on growing a strong unified Metso company and brand,” said president and CEO of Metso, Pekka Vauramo.
“We have combined two valuable companies into one strong Metso.
“Our focus is clear: we continue enabling sustainable modern life and transforming the industry with a clear strategy and strong culture, supported by a name that is short yet established and well recognised among all our stakeholders.
“Services are an extremely important part of our business, requiring a strong name.”.
The company said that Outotec continues as a product brand and carries significant value as the name of some key technologies and products.
The change of the parent company name to Metso Corporation is effective from today, but globally the change will be implemented in a phased manner."
4,7 things we learned from Caterpillar’s latest trading update,"

Last week saw Caterpillar unveil astrong performance for the first quarter of 2023, driven in large part by growth in North America.
Sales in its construction industries division increased by 10% to US$6.7 billion, while operating margin in the segment was 26.5%.
Here’s seven things we learned about Caterpillar’s performance, what it says about the wider construction industry, and where it could be heading:

Caterpillar reported better equipment availability thanks to improving supply chain conditions. But “pockets of challenge” still remain, particularly for large engines which could impact some of its larger machines.
In general, the supply chain improvements meant that Caterpillar was able to make stronger-than-expected shipments in North America, which is Caterpillar’s most constrained region as far as dealer inventory is concerned.
Caterpillar noted that there is now improved availability of its excavators. That has come about as a result not just of the lower pressure on supply chains but also because of a slowing of demand in China.
Caterpillar said it expected China’s above 10t excavator industry to remain below 2022 levels this year due to low construction activity, while its sales in China would be below the typical range of 5-10% of total Caterpillar sales in 2023.
The better availability of some types of machine in turn means that Caterpillar expects dealers to scale back their levels of inventory in the second half of the year, even though overall demand remains healthy.
The second half of 2022 saw dealers build their inventories to the tune of $1.4 billion. Talking to analysts, Caterpillar chairman and CEO Jim Umpleby said, “We are not planning for this trend to repeat [in the second half of 2023]. Instead, we expect to see dealers decrease inventories compared to the first quarter levels and end 2023 about flat relative to the end of 2022.”
Caterpillar’s overall adjusted operating profit margin for the period was 21.1% and hit 26.5% in the construction industries division. In a call with analysts, chief financial officer Andrew Bonfield explained that while Cat’s manufacturing costs did increase, they increased by less than the company anticipated.
Better-than-expected sales volumes meant factories could operate more efficiently, while freight costs were also lower. Meanwhile, the average price Caterpillar was able to charge for machines was higher than it had expected. These factors combined to boost the company’s profit margins.
But Bonfield said he did not expect the favourable effects of absorbing costs to last in the second half of the year, with margins in the remaining quarters of the year expected to be lower than the first quarter as the relationship between price and manufacturing costs normalized.
The US government has pledged to pump billions of dollars into infrastructure investments through measures such as the Bipartisan Infrastructure Law (BiL), which it is claimed involves up to $550 billion in new spending.
Umpleby confirmed that Caterpillar had started to see the positive impact of those infrastructure dollars in orders.
Speaking to analysts, he said, “The projects that don’t require a lot of permitting, things like resurfacing roads, have already started and we’re seeing the positive benefit of that.
“When customers believe there’s a pipeline of projects coming, they’re more likely typically to make that capital investment, to make a purchase of a new piece of equipment. It has started and we expect it to continue for some time.”
Caterpillar said it expected business activity in Europe, Middle East and Africa to increase in 2023 as compared to 2022. While that was down in large part to particularly strong construction demand in the Middle East, and while uncertain economic conditions remain, the company noted that European construction was “more resilient than we previously anticipated”.
When it came to mining equipment, Umpleby said he expected healthy demand, driven by the transition to new forms of energy. He noted that commodity prices remain above investment thresholds and said he expected production utilization levels to remain elevated.
He added, “We also expect the aging of the fleet and a lower level of parked trucks to support future demand for our equipment and services. We continue to believe the energy transition will support increased commodity demand, expanding our total addressable market and providing further opportunities for profitable growth.”
"
5,New 120 tonne XCMG AT crane for Europe,"



Chinese manufacturer XCMG has a new 120 tonne capacity all terrain crane for sale in Europe.
XCMG said the 120 tonne rating is calculated at 2.5 metres radius. At 3 metres the crane lifts 80 tonnes.
The XCA120 E on its four axle carrier has a 66 metre boom in six sections. An 11.65 to 18.5 metre, offsetable bi-fold swingaway jib can be added. Putting a pair of 7.1 metre lattice extensions in between the end of the boom and the swingaway gives a maximum tip height just beyond 96 metres. Maximum working radius is given as 60 metres.
An MTU diesel engine powers both the carrier and the crane upper. It has a ZF TraXon transmission with 12 forward speeds, driving the three rearmost axles. A retarder is also standard as is all wheel steering. XCMG said it has independent suspension “similar in overall concept to that used by Grove.”
Depending on tyre choice the crane’s overall width can be kept down to 2.75 metres. Overall length is given as being just over 14.3 metres.
Including their fully retracted position, the outriggers can be set at five spread widths: 3.83, 5, 5.9, and 7 metres. Maximum total counterweight is 33 tonnes, made up from eight slabs to allow multiple configurations.
June sees the official unveiling of the XCA120 E at the JDL Expo crane, transport and aerial work platform show in Beaune, France.
"
6,View full programme for ITC tower crane conference in Barcelona,"


The full speaker line-up for the International Tower Cranes (ITC) conference in Barcelona on 13 and 14 June can now be found at theconference website.
Topics include new options for powering tower cranes, the future of self-erecting towers, digital technology innovations, and a report on how tower cranes continue to work on Barcelona’s famous Sagrada Familia cathedral.


The programme is given below.Click hereto reserve your space at the event.

ITC Conference
WELCOME:Jorge Cuartero, managing director, ANMOPyC

MORNING KEYNOTE Overview of Spain’s tower crane marketMiguel Cerezo Rodríguez, CEO, Grúas Cerezo

How to power tower cranes with minimal draw from the electricity gridDr. ir. Bart Meersman, director and co-founder, Neargrid Solutions

Crane design evolution and adaptation to future construction challengesJorge Lucas, sales manager, Jaso Tower Cranes

Wire ropes on tower cranes: challenges and solutionsMarco Elig, managing director, KV R&D Center for rope development and testing

Panel discussion: Self erecting tower cranes; their place in the market and the potential for growthNicola Castenetto, business line director, Terex Tower CranesJulian Dyer, sales manager, Falcon Tower CranesJörg Hegestweiler, CEO, BKL Baukran LogistikClemens Maier, product manager, Liebherr Tower Cranes(Chaired by Murray Pollok, Director of Content, KHL Group)
AFTERNOON KEYNOTE Pushing boundaries: sustainability and new technology must lead the way in tower crane rentalAndrew Brown, managing director, Falcon Tower Crane Services

High tech safety systems in practiceLior Avitan, CEO & co-founder, Ultrawis

Steel spires: tower cranes on the Sagrada Familia cathedralAntonio Bello Figueroa, Ibergruas &Carlos Pimenta, Manitowoc Crane Group Portugal

Precision load control for increased safety and productivityViktor Mosolf, head of digitalisation, Wolffkran andDr.-Ing. Mohamad Abouelezz, head of product management, Wolffkran

Case study: planning the craneage on a construction site with multiple tower cranesAlbert Fitoussi, Managing Director, MéthoCAD

A site visit on the day before the conference, on 13 June, is being organised and we hope that it will be a visit to La Sagrada Familia in the city. More details to follow.
Event supporters
The event has the following sponsors:
The event partner is Specialized Carriers & Rigging Association (SC&RA), and supporting associations are ANMOPyC and ESTA.
"
7,Haulotte posts ‘historic’ revenues across the board,"France-based lift manufacturer Haulotte has reported “historic consolidated revenues” for the first quarter of 2023, amounting to €196.3 million (US$213.5 million).
The figure represents a 43% increase on the €135.8 million ($150 million) it achieved for the same period in 2022, and keeps the company on track to achieve its predicted 20% growth for 2023.
“All of the Group’s activities showed an increase compared with Q1 2022,” said Haulotte. “The sale of equipment is up by +48%, the rental business by +7% and finally the service business by +15%.”
These percentages equate to respective 2023 revenues of €172.6 million ($190.6 million), €5.8 million ($6.4 million) and €17.9 million ($19.7 million).

While the prediction takes into account a strong historic order book, the company describes the aerial platform market as “dynamic” and says that pressure on the components supply chain is continuing to ease.
Regionally, the company saw the biggest growth in North America, where the uptake of aerial platforms is continuing to rise.
“Haulotte confirmed the results seen in previous publications and posted growth of +72% in the first quarter, largely driven by the aerial work platform business, which more than doubled compared to the same period last year.”
The Latin American and Asia-Pacific regions both saw first quarter sales grow by 38% compared to the same period last year and “In Europe, sales were up by +35% in the first quarter, driven by all markets except for Russia, which is at a standstill”.


"
8,Engineering firm converts 1.6t excavator into disaster rescue robot,"

Forth Engineering, based in Cumbria in the UK, has built a remote-controlled ‘rescue robot’ designed to be sent into disaster zones and controlled remotely.
The machine is based around a 1.6t JCB compactor excavator platform.
It is tetherless and can be controlled from a safe location up to 150 metres away.
It carries a 700bar rescue tool, a grapple hook to move obstructions, a hopper to disperse sand to contain spillages, and an affixative spraying system to contain a nuclear spillage.
The robot has already been trialled at Sellafield nuclear site in Cumbria and Forth is now looking it rolling it out to other plants across the UK.
Mark Telford, Forth’s managing director, said: “The Rescue Robot is a pioneering development which has already been successfully tested in hazardous environments, and it has been manufactured to offer a safe, remotely operated alternative to sending humans into disaster zones.
“By working with Sellafield Ltd, we were able to prove the machine is able to withstand some particularly dangerous conditions, and its various adaptations and capabilities mean that this will be a real asset to the UK’s nuclear industry.
“There are endless amounts of modifications and end effectors which can be included on the robot, and we are excited to be able to provide a product which will make working in nuclear plants across the country much safer, while also saving industry a substantial amount of money.”
“Sellafield Ltd required the development of a 1.6 tonne robot, but we are able to adapt the product to any size and also fit it with any type of tools or end effectors to fit the nature of the project.
“What is extremely exciting to us is that it can also be adapted to work in any industry, and it is a real game changer in reaching some of the most dangerous environments found in sites across the UK.”"
