date,제목
2022-07-14,200 tonnes on the hook – MaxiKraft installs crane girder using LR 11000
2022-07-13,Liebherr wins 2022 architectural digest design award 
2022-07-13,Liebherr partners with So-Low Environmental to expand market
2022-07-08,Morrow Equipment purchases 27 Liebherr tower cranes
2022-07-07,From the water to the world - How Liebherr cranes on the Rio Paraguay contribute to functioning trade.
2022-07-06,Liebherr LAMC Aviation (Changsha) obtains CCAR-145 Maintenance Organization Certificate
2022-06-28,Taking off with Liebherr electronics: high-tech drones by Quantum-Systems
2022-06-24,Liebherr Application Center in Colmar: customised crawler excavators
2022-06-23,Long boom and high lifting capacities convince – LTM 1230-5.1 for Soliman
2022-06-21,Press Kit: Bauma Media Dialogue 2022
2022-06-21,Liebherr presents its new mixing plant generation at Bauma
2022-06-21,For the construction site of the future – Liebherr unveils new tower cranes and digital solutions
2022-06-21,Towards emission-free construction sites with Liebherr energy storage systems 
2022-06-21,Lightweight to increase capacity – the new fibre rope cranes from Liebherr 
2022-06-21,The Liebherr-Components world at Bauma 2022
2022-06-21,Electrifying: Liebherr launches six new unplugged machines 
2022-06-21,Bauma 2022: Product highlights and innovations for Liebherr earthmoving and material handling machines 
2022-06-21,Liebherr Mining to unveil new mid-class excavator model and other innovations at Bauma 
2022-06-21,R 928 G8 with Leica semi-automatic machine control at Bauma 2022
2022-06-21,Liebherr presents material handlers for diverse applications at Bauma 2022
2022-06-21,At Bauma 2022: Liebherr rail-road excavator with hydrostatic drive concept and début for articulated dump truck
2022-06-21,New Liebherr wheel loaders at Bauma 2022
2022-06-15,Fortescue and Liebherr establish partnership for zero emission mining equipment
2022-06-14,Management changes at Liebherr-Aerospace & Transportation SAS
2022-06-13,"""On your site"": Liebherr at Bauma 2022"
2022-06-10,Study confirms Technology neutrality reduces the most emissions
2022-06-08,The new Liebherr mobile harbour crane
2022-06-08,Liebherr Generation 8 crawler excavators conquer Corsica
2022-06-07,100 percent Liebherr – Gräber extends fleet with new mobile cranes 
2022-06-03,Liebherr selected to supply valves for Pearl 10X engine
2022-06-02,Liebherr earthmoving and material handling machines at Svenska Maskinmässan 2022
2022-06-02,Liebherr earthmoving and material handling machines at Svenska Maskinmässan 2022
2022-06-01,Skyscraper construction in Singapore: World first for Liebherr luffing jib cranes
2022-05-31,Liebherr-Aerospace receives supplier award from Rolls-Royce
2022-05-31,Liebherr introducing ECM certification for rail-road excavators
2022-05-30,Liebherr at the 28th International Exhibition for Track Technology in Münster
2022-05-30,Liebherr at IFAT 2022 in Munich
2022-05-25,Liebherr apprentices reach H2GP finals with hydrogen drive
2022-05-25,Future-oriented – Lelieur takes delivery of Liebherr LTM 1230-5.1 mobile crane 
2022-05-24,Smart equipment solutions: Liebherr presents new multi-tine grab 
2022-05-16,"Customer Day at Liebherr: Expanded Operations, Expanded Solutions"
2022-05-16,STRABAG relies on LIKUFIX® from Liebherr 
2022-05-12,Spare parts from Liebherr for Desiro trains in Bulgaria
2022-05-12,AVR relies on Liebherr cameras and displays
2022-05-11,Versatile and flexible: LTM 1110-5.1 complements Fagioli crane fleet
2022-05-10,MyLiebherr homepage: new design and features enhance user experience
2022-05-09,A first for Serbia – Beokran takes delivery of Liebherr LTM 1150-5.3 mobile crane
2022-05-06,Liebherr-Mischtechnik GmbH and FBR cooperate to commercialise bricklaying robot
2022-05-03,Two Liebherr R 9200 for NMDC iron mines in India 
2022-05-03,In a double pack: Clausen Kran AG procures Liebherr mobile cranes
2022-05-02,HLC 295000 ready to work
2022-04-28,New LTM 1750-9.1 becomes the most powerful crane in the Magis fleet 
2022-04-25,Liebherr earns spot in Boeing Premier Bidder Program
2022-04-22,100 percent Liebherr – Klüttgens expands crane fleet with LTM 1060-3.1
2022-04-21,An ode to the wind
2022-04-21,Two new Liebherr power packs – Grúas Leman takes delivery of LTM 1650-8.1 and LR 1700-1.0
2022-04-19,“The crane always has another ace up its sleeve”
2022-04-14,Liebherr-Aerospace at MRO Americas 2022
2022-04-14,Strong performers: Liebherr presents new mid-sized wheel loader series
2022-04-14,New Liebherr mid-sized wheel loader series
2022-04-12,The Liebherr highlights of 2021
2022-04-11,Liebherr and Airbus: Landing Gear Collaboration
2022-04-11,Crane power for the climate revolution
2022-04-07,Liebherr and HAL sign Memorandum of Understanding
2022-04-07,Game changer – LR 12500-1.0 added to Liebherr’s portfolio of large crawler cranes
2022-04-07,The first Liebherr LR 12500-1.0 crawler crane goes to Sarens
2022-04-06,Liebherr awarded engine contract with BHP
2022-04-06,"Zero emission, full power – Liebherr LTC 1050-3.1 mobile crane with electric power unit"
2022-04-06,MyLiebherr makes purchasing and managing licences easy
2022-04-05,Liebherr’s MDC3 camera – The best choice for Sandvik
2022-04-05,"Stevenson Crane, Rigging, and Heavy Haul adds Liebherr LR 1500 Crawler Crane to fleet in 2022"
2022-04-04,2021 Annual Report
2022-04-04,Liebherr: Significant boost in turnover of the Liebherr Group in 2021 
2022-03-31,Deutsche Aircraft selects Liebherr to supply flap and spoiler actuation system for D328eco aircraft
2022-03-31,Liebherr Italia brings service even closer to its customers 
2022-03-30,ESTA Awards: LR 1400 SX wins
2022-03-29,The perfect lift: behind the scenes of Crane Planner 2.0 
2022-03-28,Fourth generation of 90 tonne cranes – Saller takes delivery of Liebherr LTM 1090-4.2
2022-03-25,Liebherr on-board in new air-free Siemens Brake System
2022-03-25,Liebherr’s dealer in Luxembourg: Comat celebrates its 50th anniversary
2022-03-24,Timeless Freshness: New freestanding appliances from Liebherr combine innovative technology and elegant design. 
2022-03-22,Workout with 100 tonnes: LR 1100.1
2022-03-18,Liebherr and HAECO extend their landing gear service agreement in China
2022-03-17,Maximum flexibility – Steil buys Liebherr LTM 1650-8.1 with all its boom versions
2022-03-14,Liebherr continues successful cooperation with start-ups
2022-03-10,Liebherr and Tula join research activities 
2022-03-10,LHM 550 celebrates 300th delivery
2022-03-10,Reinforcements for ESEASA – seven new Liebherr rough terrain cranes for the fleet
2022-03-09,LiMain: Changing the way you think about maintenance
2022-03-09,Wind-assisted propulsion:Harness the wind with Liebherr
2022-03-08,Danish construction company M.J. Eriksson relies on Liebherr TA 230 Litronic dump truck 
2022-03-07,Liebherr-Aerospace in Singapore reached significant milestone
2022-03-03,On the current situation in Ukraine
2022-03-03,Electrifying: LR 1160.1 unplugged
2022-03-02,Three at one blow – Herrmann & Wittrock modernises fleet with Liebherr mobile cranes
2022-02-25,Digital clearance monitoring for slewing bearings
2022-02-23,SAEI and Liebherr deepen their collaboration
2022-02-21,New alternative selected – Ley-Krane decides on rope pull technology option for its new LTC 1050-3.1
2022-02-18,First PR 776 mining dozer in Indonesia
2022-02-17,Liebherr signs agreement with Tigerair Taiwan on A320neo component support
2022-02-16,Cause for celebration: Liebherr delivers 1000th mobile construction crane
2022-02-09,Liebherr-Aerospace at MRO Middle East 2022
2022-02-09,A first in Brazil – Guindastes Tatuapé takes delivery of Liebherr LTM 1120-4.1 mobile crane
2022-02-08,Liebherr-Aerospace at Singapore Airshow 2022
2022-02-03,Relocation of Liebherr-Aerospace Customer Services base in Shanghai on track
2022-02-03,Crane Planner 2.0 – 3D lift planning now with new mobile cranes
2022-02-02,Most powerful 5-axle mobile crane for Brazilian group Calsimec
2022-02-02,Historic tower crane returns to Liebherr
2022-02-01,The largest crane in the “Tough Ones” series: Liebherr presents its 470 EC-B Flat-Top crane
2022-01-31,Entry into service: Liebherr-Aerospace on board the H160
2022-01-31,66 meter telescopic boom: Auto-Klug chooses Liebherr LTM 1150-5.3
2022-01-28,In Spain's largest wind farm: Transbiaga with three Liebherr LG 1750s in operation
2022-01-27,Around the world with 80 cranes
2022-01-27,A journey through the world’s refrigerators
2022-01-27,New customer – Levantek adds Liebherr LTM 1160-5.2 mobile crane to its fleet
2022-01-25,New NC-B 12-70 demonstrates its strength in Saudi Arabia
2022-01-24,Liebherr LTM 1650-8.1 installs bridge in area struck by disaster 
2022-01-21,Liebherr showcases THP 80-LP Truck mounted concrete city pump at World of Concrete 2022 trade show
2022-01-21,Fuel cell: technological partnership between GreenGT and Liebherr
2022-01-19,Reaching new heights – Liebherr unveils mobile crane with 90 metre telescopic boom – the new LTM 1300-6.3
2022-01-19,HVO as an alternative fuel at Liebherr
2022-01-18,Modernisation and expansion – Schuch buys 15 new Liebherr mobile cranes
2022-01-14,Construction (hi)stories: It’s a small world
2022-01-13,"Liebherr appoints Dr. Tim Gerhardt as new Managing Director of Liebherr USA, Co."
2022-01-13,Liebherr Indonesia’s established service leads to customer satisfaction
2022-01-13,Rising to meet global challenges: Liebherr launches three new wheel loaders
2022-01-12,Three Liebherr Auto RMGs enter service at CSX Intermodal in North Carolina
2022-01-12,Liebherr presents new compact loader series
2022-01-12,Liebherr presents new compact loader series with the new L 504 compact model
2022-01-11,Successful Liebherr-Aerospace’s Regional Technical Workshop in the USA 
2022-01-03,Experts in refrigeration to unveil largest product lineup to date at KBIS 2022
2021-12-22,Number 27 in the company’s 27th year – Ullrich takes delivery of Liebherr LTM 1060-3.1
2021-12-21,New Liebherr MK 88-4.1 heads to Italy
2021-12-17,Fleet addition: new Liebherr LR 1700-1.0 crawler crane for Eurogrúas 2000
2021-12-16,Liebherr crawler excavator R 960 SME conquers the world market
2021-12-15,Liebherr-Aerospace Brasil receives new Embraer approvals
2021-12-15,In the spotlight: Liebherr cranes help create impressive stage sets 
2021-12-14,German Ambassador visits Liebherr Singapore
2021-12-13,100 percent Liebherr: Hess extends fleet with LTM 1150-5.3 
2021-12-10,Long-term partnership for Liebherr Indonesia
2021-12-09,Most powerful crane in the fleet – Wasel extends crawler crane portfolio with LR 11000 
2021-12-08,Bridge building with AS Manutention’s new LTM 1750-9.1 mobile crane
2021-12-06,Blade replacement at a wind farm – tandem hoist by Liebherr mobile cranes 
2021-12-03,Acciaierie d'Italia places major order of four Liebherr LPS 800s
2021-12-03,Liebherr-MCCtec GmbH awarded gold sustainability rating from EcoVadis
2021-12-01,Liebherr-Aerospace extends its MRO component capabilities in China
2021-12-01,Night shift at the steelworks
2021-11-30,Alstom and Liebherr sign collaboration agreement on optimizing hydrogen fuel cells
2021-11-30,Continuous growth of customer services business in France
2021-11-30,Where business and science develop digital solutions 
2021-11-30,Closing the gap – Colonia takes delivery of Liebherr LTM 1110 5.1 mobile crane
2021-11-30,Liebherr-Australia opens new branch in Kalgoorlie
2021-11-26,Hautes-Alpes Département: Liebherr crawler excavator R 926 G8 convinces SATP
2021-11-25,Liebherr-Aerospace to Supply Heat Exchangers for Space Inspire Telecommunication Satellite
2021-11-25,"Engineered for the future, built on experience – Liebherr LTM 1110-5.2 mobile crane"
2021-11-24,"Liebherr (China) Co., Ltd. receives ISO 9001:2015 Certification"
2021-11-24,New cranes to celebrate company anniversary – Hanyš updates fleet with Liebherr cranes
2021-11-24,Four new Liebherr machines for Feickert 
2021-11-22,Euroports invests in emission-free LPS 420 E
2021-11-22,"Liebherr win contract to supply automated cranes to Port of Duqm, Oman"
2021-11-19,"“The future is small, compact but powerful mobile cranes”"
2021-11-18,Premiere – first Liebherr compact cranes with rope pull technology delivered
2021-11-17,Eineder modernises crane fleet with Liebherr LTM 1250-5.1 mobile crane
2021-11-16,Successful in Latin America – high number of Liebherr mobile cranes heading for Chile
2021-11-12,CMI Energia acquires first LR 1600/2 in Honduras
2021-11-11,A last goodbye – Last Liebherr LTM 1500-8.1 mobile crane goes to LOCAR
2021-11-10,Premiere in Canada – Guay takes delivery of its first two LTM 1110-5.1 mobile cranes
2021-11-09,Travelling up to the treeline with snow chains
2021-11-09,The new weightlifter: LR 1400 SX
2021-11-05,Mazeau Recyclage welcomes a new Liebherr LH 80 M High Rise materials handler
2021-11-04,Liebherr tower cranes get new touch display with smart operating system
2021-11-03,Liebherr blade bearings for tomorrow’s service operations
2021-11-03,Three Liebherr L 586 XPower® wheel loaders for BTB Group Berlin
2021-11-03,Profitability as a unique selling point: Three Liebherr L 586 XPower® wheel loaders for BTB Group Berlin
2021-11-03,Rounding off the portfolio – Seeland decides to purchase the Liebherr LTM 1150-5.3
2021-11-03,Mobile harbour cranes with electric drive in high demand
2021-11-02,Liebherr’s H2 direct injection solutions for heavy-duty engines
2021-11-02,Liebherr-France SAS: Christophe Sanchez replaces Martin Schickel as Director General
2021-10-29,The end of an era – the last LR 1600/2 leaves the Liebherr Plant in Ehingen
2021-10-28,An interaction that rules
2021-10-28,Jubilee: Excavator marking 60 years of Liebherr in France handed over to the Chavaz Père et Fils company 
2021-10-27,Liebherr ends first half of the year with positive result
2021-10-27,Unique – Dźwig-Mar takes delivery of the first LTM 1650-8.1 in Poland
2021-10-25,Liebherr reaches a new milestone in tunnelling
2021-10-22,Liebherr spare parts for overhaul of CTA’s 5000-series level control systems
2021-10-22,Third Liebherr LR 11000 crawler crane delivered to Felbermayr
2021-10-21,Montejo erects wind turbines in Colombia using LR 1600/2-W
2021-10-21,"One Topic, Three Industries: The Present and Future of Cooling"
2021-10-19,Mukran Port relies on Liebherr on the New Silk Road
2021-10-18,Modern Liebherr mixing plant of type Betomix 2.5 in operation in Berlin
2021-10-14,MAHLE Powertrain collaborates with Liebherr to co-develop active pre-chamber technology for heavy-duty hydrogen-fuelled engines
2021-10-13,From site to site: The new MK 73-3.1 from Liebherr in action
2021-10-12,Elephant rescue in the River Wupper – LTF 1045-4.1 hoists Tuffi back onto her plinth 
2021-10-11,Liebherr to supply thrust reverser actuation system for Rolls-Royce Pearl® 10X engine
2021-10-11,New York: Liebherr 125 K crane erects eight-storey residential building
2021-10-08,Looping the cosmic loop
2021-10-07,Health Management: Two new contracts for Liebherr Analytics Solutions
2021-10-07,First Liebherr crawler excavator R 934 G8 in Corsica goes to the Graziani TP company
2021-10-05,Three new Liebherr Megamax STS for Maher Terminals LLC
2021-10-05,Turn two into three
2021-10-04,Liebherr takes part in the C³-Mobility research project
2021-10-04,Liebherr-Aerospace at MRO Europe 2021
2021-09-29,Liebherr at the 2021 International Metro Transit Exhibition and Forum
2021-09-28,Crane fleet expansion – Baumann takes delivery of Liebherr LTM 1150-5.3 mobile crane 
2021-09-23,“Blue Beast” makes its debut – first Liebherr LTM 1650-8.1 for ALL Erection & Crane Rental 
2021-09-22,Liebherr begins construction of new components plant in China
2021-09-22,Liebherr exclusive provider for Lineage 1000 landing gear overhaul
2021-09-21,LiCAS passes test successfully
2021-09-17,Liebherr at the Küchenmeile 2021: futuristic features meet outstanding product design
2021-09-17,More power in the Caribbean: Força strengthens crane fleet with Liebherr LTM 1400-7.1
2021-09-16,SAB purchases Liebherr wheel loaders and crawler excavator
2021-09-16,Powerful start: New crawler crane from Liebherr is here
2021-09-15,"Liebherr and ABB accelerate all-electric mine transition, focussing on haul truck trolley support"
2021-09-15,First Quantum to operate world’s largest ultra-class truck trolley fleet with Liebherr T 284
2021-09-15,"New 36 XXT truck mounted concrete pump from Liebherr: Light, compact and flexible"
2021-09-15,Liebherr partners with Hexagon to deliver next generation mine automation
2021-09-14,Liebherr and ENGIE partner to offer carbon-neutral solutions for the mining industry
2021-09-14,Liebherr-Mining introduces advanced Assistance Systems & On-board Analytics
2021-09-14,"Liebherr Mining presents next generation, interoperable machine automation"
2021-09-14,Liebherr Mining introduces data-driven Digital Services
2021-09-14,Liebherr Mining advances Zero Emission Program
2021-09-14,Liebherr at Pollutec 2021
2021-09-14,Première in Africa: Allied Crane Hire takes delivery of Liebherr LTM 1230-5.1 mobile crane
2021-09-14,Argonaut Gold secures four Liebherr dozers
2021-09-13,Liebherr presents rough-terrain crane LRT 1090-2.1 at MINExpo in Las Vegas
2021-09-13,Liebherr unveils latest additions to mining equipment portfolio
2021-09-13,Premiere: Scholpp acquires the first for-hire Liebherr MK 73-3.1 mobile construction crane
2021-09-09,Liebherr-Aerospace Customer Services score high in Latin America and the Caribbean region
2021-09-09,Allamanno: Liebherr wheel loader and crawler excavator in the French département of Hautes-Alpes
2021-09-07,LTM 1450-8.1 from Advanced Cranes dismantles weir in Victoria
2021-09-06,The first Liebherr R 936 Compact crawler excavator on Corsica
2021-09-03,Looking towards the future
2021-09-01,Third Liebherr L 586 XPower® wheel loader for the Rinsche gravel plant
2021-09-01,Economical in mining operations: third Liebherr L 586 XPower® wheel loader for the Rinsche gravel plant
2021-08-31,Smart support from Liebherr High-Top crane boosts production
2021-08-31,LHInspect gear measuring software
2021-08-30,Air conditioning systems from Liebherr on board Hungarian passenger trains
2021-08-30,Liebherr: MK 88 Plus achieves 300 lifts in three days
2021-08-30,Darcy Pacheco increases capacities with a new LTM 1750-9.1
2021-08-27,The company Nouvelles Carrières d’Alsace (N.C.A) once again opts for Liebherr quality
2021-08-27,At a glance: Digital solutions from the world of Liebherr 
2021-08-25,XpertAssist – real-time remote support
2021-08-17,Liebherr-Transportation Systems: A hub for support and maintenance in the UK
2021-08-16,The duty cycle crawler crane that changed Liebherr 
2021-08-16,Liebherr USA. Co. launches partnership with Advance Technical Institute in new Co-op program for service technicians
2021-08-16,Compact crane – Leitl adds LTC 1050-3.1 to its crane fleet
2021-08-11,Sardinia – Liebherr LTM 1120-4.1 mobile crane with long boom in action at a refinery
2021-08-10,Number two: Paradiso takes delivery of Liebherr LG 1750 lattice boom mobile crane
2021-08-09,Liebherr sells its 2000th 34 K fast-erecting crane
2021-08-07,Liebherr strengthens supply chain services with Encompass partnership
2021-08-06,Thiess expands fleet in Chile with new Liebherr T 264
2021-08-06,Liebherr fast-erecting crane 34 K at work on the tallest building in the Benelux region
2021-08-05,Time-tested concept – Max Bögl Group takes delivery of another Liebherr LTR 1220 telescopic crawler crane 
2021-08-05,Liebherr floating cranes supply North Vietnam with energy
2021-08-03,"Liebherr USA, Co. announces new Managing Director"
2021-08-03,"Kai Friedrich appointed new Managing Director of Liebherr USA, Co."
2021-08-03,Liebherr HVAC units on-board maglev train in China 
2021-08-02,New Monolith: Liebherr continues expansion of iconic product line
2021-08-02,Liebherr in Ehingen switches to climate-neutral HVO fuel
2021-07-29,Successful joint venture in China
2021-07-28,50th Liebherr machine delivered for Mainka
2021-07-27,Bruns Kranvermietung based in Lüneburg takes delivery of its first Liebherr mobile crane
2021-07-26,Chasing the cold
2021-07-26,TEST Chasing the cold
2021-07-20,Liebherr welcomes HAECO as new partner for heat exchanger servicing
2021-07-15,Liebherr to present its latest innovations at MINExpo 2021
2021-07-15,Premiere – prefabricated constructions specialist Pekabex invests in Liebherr mobile crane 
2021-07-14,On the road to the digital transformation in production: Liebherr collaborating with startup 
2021-07-13,Two top class models – column loaded by Liebherr tandem hoist
2021-07-12,"Liebherr implements new field tech team to enhance support for service technicians, installers, dealers & distributors"
2021-07-12,French Minister Delegate for Transport visits Liebherr
2021-07-12,Transnacional adds used LTM 1500-8.1 to its crane fleet
2021-07-09,Liebherr-Aerospace puts a new machining center integrating a Liebherr robot into operation
2021-07-08,Everything remote: Distance not an issue for Liebherr
2021-07-08,Ten new Liebherr wheeled excavators for Julius Berger
2021-07-07,Liebherr joins eFuel Alliance
2021-07-07,"1,300 maritime cranes – from Rostock to the world"
2021-07-06,Sand from Dubai for an experiment in Pinghu
2021-07-06,“VarioBase® is the Ferrari of crane support systems”
2021-07-05,A new addition to the “Tough Ones” series: The new 205 EC-B 10 Flat-Top crane from Liebherr
2021-07-05,Rhenus Group relies on Liebherr 
2021-07-02,Hüffermann sets up new rental fleet with tower cranes from Liebherr
2021-06-30,Sustainability Award: EcoVadis Medal for Liebherr-Hausgeräte Lienz 
2021-06-30,"Liebherr (China) Co., Shanghai First Branch Receives ISO14001:2015 Certification"
2021-06-30,Klema expands fleet with Liebherr LTM 1110-5.1 mobile crane
2021-06-29,First job in the Netherlands – Sarens erects wind turbines using Liebherr LR 11000 crawler crane
2021-06-28,ALL relies on two Liebherr cranes for dual pick at bridge in Cleveland 
2021-06-25,Liebherr mobile crane helps place explosives at a height of 140 metres
2021-06-23,This is a Press Release
2021-06-22,Only truck-mounted cranes in the fleet – Krösche takes delivery of Liebherr LTF-1045 4.1 crane
2021-06-17,Liebherr and GM to develop HYDROTEC fuel cell-based electrical power generation system for aerospace application
2021-06-17,Three new Liebherr mobile cranes for Coamtra-Symco
2021-06-16,Liebherr LHM 800 takes Veemnatie to new heights
2021-06-15,Fourth Liebherr crawler crane in a year – Al Faris takes delivery of LR 1500
2021-06-11,Liebherr fast-erecting crane on the island of Mainau
2021-06-11,Delivery of Landing Gears for 100th ARJ21 Serial Aircraft
2021-06-10,Darcy Pacheco erects monumental statue of Christ using two Liebherr LTM 1220 5.2 mobile cranes
2021-06-08,Liebherr-Aerospace: Eco-responsibility in MRO means performance 
2021-06-07,Liebherr transfers rental business for tower cranes in Paris and Northern France to Hexagone Services S.A.S.
2021-06-07,Liebherr cockpit static inverter for Airbus A320 and A330 families
2021-05-28,Liebherr expands portfolio with series-production range for piston accumulators
2021-05-26,Liebherr T 274 – the new 305 t mining truck
2021-05-26,Liebherr supplies further air conditioning equipment for Stuttgart’s suburban railway
2021-05-26,Liebherr air conditioning units for the Rhein-Main suburban railway system
2021-05-26,First Liebherr Mobile Harbour Crane with fossil-free diesel
2021-05-25,Electronics Manufacturing Services at Liebherr: a look behind the scenes 
2021-05-20,Structural Unlimited‘s LR 1300.1 SX crawler crane provided high lifting capabilities for construction of the new CHKD Mental Healthcare facility parking garage
2021-05-19,Liebherr - a reliable partner for fuel injection solutions in the U.S.A.
2021-05-19,Liebherr HVAC Units for Trains in Bangladesh and Tanzania
2021-05-19,First Liebherr LTM 1650-8.1 mobile crane in Spain delivered to Grúas Ibarrondo
2021-05-18,Liebherr-Verzahntechnik GmbH presents solutions at Metalloobrabotka in Moscow
2021-05-18,Liebherr-Aerospace at MRO Middle East 2021
2021-05-18,New Liebherr articulated dump truck receives Red Dot Award 2021 
2021-05-17,Tanger Alliance at the TC3 terminal in Tanger Med operating at full capacity with eight new Liebherr ship to shore container cranes
2021-05-12,Liebherr-Aerospace launches new service platform
2021-05-12,Versatile Liebherr material handling machine in operation at Leutkircher Wertstoffhof recycling centre 
2021-05-12,“The future for the crane industry is emission free”
2021-05-11,Liebherr adds LTR 1040 to its telescopic crawler crane series
2021-05-10,Liebherr on board Dassault’s new Falcon 10X business jet
2021-05-04,LIKUFIX quick-change system available for other Liebherr wheel loaders
2021-05-04,Modernization: Crane Maier takes over Liebherr mobile crane LTM 1070-4.2
2021-05-04,Ready for new tasks at the push of a button: LIKUFIX quick-change system available for other Liebherr wheel loaders
2021-04-29,Fully operational for Swiss natural product: Liebherr LH 60 M Port Litronic material handler
2021-04-29,ESTA Awards: LR 1250.1 unplugged wins 
2021-04-28,Large crane offensive: Hüffermann expands fleet with Liebherr mobile and crawler cranes
2021-04-28,Liebherr supplies air conditioning systems for passenger coaches to Slovakia
2021-04-27,New training solutions by Liebherr-Aerospace Customer Services
2021-04-27,Technology for the green aircraft of the future
2021-04-26,Value for aircraft operators
2021-04-26,Greater lifting capacity with higher wind tolerance
2021-04-26,Liebherr wins ESTA Award in the safety category 
