date,제목
2021-04-22,New Liebherr R 928 G8 crawler excavator: The new addition to the Generation 8 family
2021-04-22,Liebherr website facelift shows elements of the new corporate design for the first time
2021-04-21,Sycratronic as trailblazer for the wind industry
2021-04-21,New maximum: Flossdorf adds Liebherr LTM 1650-8.1 mobile crane 
2021-04-20,Signed and sealed – Liebherr to kick off assembly of hydraulic cylinders in China
2021-04-20,Replacement after 23 years: RMT rounds off all-terrain crane fleet with Liebherr LTM 1130 5.1
2021-04-19,Annual Report 2020
2021-04-19,Liebherr: The Liebherr Group achieves over ten billion euros in annual turnover
2021-04-19,"First LTM 1120-4.1 on the Iberian Peninsula for Grúas Aguilar, Quality Grúas and Transgrua"
2021-04-14,"CELSINEO: More than 200,000 operating hours"
2021-04-14,Liebherr Receives Gold Award from COMAC
2021-04-14,New and used – three more Liebherr mobile cranes for Moroccan customer SCIF 
2021-04-13,Liebherr-Aerospace at MRO Americas 2021
2021-04-13,More with the same – I.V. Guindastes upgrades LR 1600/2-W
2021-04-13,"Like a racing car, only a little bigger"
2021-04-12,Beyond borders: services for the wind industry 
2021-04-09,Two new local zero emission excavators from Liebherr: R 976-E and R 980 SME-E electric crawler excavators
2021-04-07,LiView position transducer in the new crawler loader generation
2021-04-06,Liebherr Analytics in Service
2021-04-06,Bulet takes delivery of the first Liebherr LRT 1090-2.1 rough terrain crane in Nigeria
2021-04-01,Urban development in Bremen – Sommer installs components for stairwell using LTM 1450-8.1
2021-04-01,Liebherr R 9600 excavators perform in Australia
2021-03-31,A second added to the fleet – Rothmund shows its support for the Liebherr LTM 1230 5.1 mobile crane
2021-03-30,The new MK 73-3.1 mobile construction crane from Liebherr: a compact taxi crane with optimal reach
2021-03-30,Liebherr Container Cranes to supply two new STS to The Port of Liverpool
2021-03-29,Perfect for construction crane assembly – Schussmann takes delivery of Liebherr LTM 1230-5.1 mobile crane
2021-03-26,Service made Simple: New SCR parts kit
2021-03-25,New Liebherr LTM 1120-4.1 shows its capabilities on Swiss sites
2021-03-25,Liebherr invests in its Ehingen site
2021-03-24,Liebherr Signs Agreement on Landing Gear Overhaul with Portugália
2021-03-24,Addition to the fleet – Steil purchases Liebherr LTM 1120-4.1 mobile crane
2021-03-24,Liebherr New Council Member of the Shanghai Air-conditioning and Refrigeration Institute 
2021-03-24,The foundations for Norway’s longest railway bridge 
2021-03-24,Liebherr launches R 9600: The next generation of hydraulic mining excavators
2021-03-23,Sönke Jordt expands fleet with a Liebherr LTM 1110-5.1 mobile crane
2021-03-18,First Digital Suppliers’ Day at Liebherr-Aerospace
2021-03-17,Liebherr develops high-speed air compressors for fuel cell propulsion for rail transport market
2021-03-17,Crane trio: 8-axle cranes from Eisele and Riga work for monument protection
2021-03-15,First Flight: Liebherr-Aerospace on board the Falcon 6X
2021-03-15,Liebherr to Deliver Air Preparation Subsystem for Airbus A321 XLR Fuel Tank Inerting System
2021-03-15,Liebherr Container Cranes Ltd. strengthens North American sales and service through closer integration with local Liebherr companies
2021-03-12,Top-class logistics: 25 Liebherr tower cranes at work on the Überseequartier district in Hamburg’s HafenCity area
2021-03-11,Liebherr-Aerospace Digital Smart MRO - Remote Assistance Technologies
2021-03-10,Liebherr supplies SNCF with additional air conditioning systems for TER 2N NG trains
2021-03-10,First main components of Liebherr HLC 150000 ready for installation on Alfa Lift
2021-03-09,Ulferts & Wittrock orders another 31 Liebherr mobile cranes
2021-03-08,Liebherr air conditioning units for trams in Melbourne
2021-03-05,Model update: Liebherr introduces performance increase to L 550 and L 556 XPower® wheel loaders
2021-03-04,Successful IRIS Certification
2021-03-04,30 years in the ground – LTM 1500-8.1 removes 104-tonne tower crane foundation
2021-03-03,More LHM – More Business
2021-03-03,Liebherr Celebrates Over Twenty Thousand Repairs of Aerospace Components in China
2021-03-03,Liebherr Powerbloc proves its value in concrete pumping
2021-03-02,AKM expands crane fleet with LTM 1650-8.1 and LTM 1120-4.1
2021-03-01,Successful tests of Liebherr air conditioning system for new Vienna metro 
2021-03-01,Liebherr-Hausgeräte: Introducing a New Range of Fully Integrated Appliances
2021-03-01,Innovative and individual:Liebherr launches a new range of fully integrated appliances
2021-03-01,New Liebherr ship to shore container crane enters service at Terminales Maritimas Del Sureste in the Port of Alicante
2021-03-01,New EU energy label: Liebherr-Hausgeräte highlights its leading role in energy efficiency
2021-03-01,Liebherr-Hausgeräte is switching to the new EU energy label and continues to impress with its energy efficiency 
2021-02-26,Liebherr-France SAS: the largest Liebherr demolition excavator ever built handed over to AWR Abbruch GmbH
2021-02-25,Guindastes Tatuapé enlarges fleet with new LTM 1500-8.1 after 30 years of great partnership with Liebherr
2021-02-24,Liebherr maintains air conditioning systems for Graz trams
2021-02-24,Belgium: Ijzerland opts for R 944 C High Rise electric crawler excavator
2021-02-23,Expanding the fleet – Darcy Pacheco takes delivery of Liebherr LTM 1500-8.1
2021-02-22,Liebherr Performance Days – The Americas: Tech Arena – Where Virtual Meets Reality 
2021-02-22,Liebherr crane package for Krandienst Schulz
2021-02-18,A world first in Great Britain: delivery of Liebherr’s first hydraulic excavator with a factory-fitted Leica Geosystems machine control system
2021-02-17,Wasel takes delivery of new Liebherr LTM 1650 8.1 mobile crane and orders new LR 1700 1.0 crawler crane
2021-02-16,Liebherr Mining Extends its Operator Training Simulator Offer
2021-02-15,CELSINEO on LinkedIn
2021-02-15,Liebherr presents new Smart Tyre Saving System
2021-02-15,Mobile and powerful – Liebherr unveils new 700-tonne LR 1700-1.0 crawler crane
2021-02-11,First R 9150B Mining excavator in the U.S
2021-02-11,Liebherr Receives the 2021 Bronze Corporate Social Responsibility Rating from Ecovadis
2021-02-11,Liebherr LTM 1230-5.1 mobile crane installs elevator shaft against the backdrop of the Frankfurt skyline
2021-02-09,SEA-invest orders two further ship to shore container cranes for Antwerp Container Terminal
2021-02-09,Schwientek takes delivery of new LTM 1120-4.1 from Liebherr
2021-02-03,Liebherr advances into new dimensions with the world's largest slewing drive units
2021-02-02,Hamburg: A new Liebherr Generation 8 crawler excavator for the Hagedorn company
2021-02-01,Job-sharing at Bracht – LTM 1450-8.1 fast-erecting crane impresses in tandem hoists
2021-01-29,Liebherr remains Mobile Harbour Crane market leader 
2021-01-29,New attachment from Liebherr: Expansion of range of applications of wheeled and crawler excavators 
2021-01-28,Made to measure – LTM 1100-4.2 from Tage Kristensen in action on a narrow pier in Hanstholm
2021-01-28,Liebherr appliances ensure safe storage of temperature-sensitive substances down to -86 degrees Celsius 
2021-01-27,"River transportation, a long lasting success for Liebherr-Mining Equipment Colmar"
2021-01-27,"France’s Minister of the Economy, Finance and Recovery visits Liebherr in Connection with the Recovery Plan for the Aviation Industry"
2021-01-27,North Sea Terminal Bremerhaven (NTB) prepared for the future with the four new Liebherr ship to shore (STS) container cranes
2021-01-27,CLAAS relies on Liebherr IoT gateways
2021-01-26,Stronger Presence in India
2021-01-26,First Generation 8 R 926 excavator in Belgium
2021-01-25,Liebherr at Aero India 2021
2021-01-22,“We found everything in Liebherr”
2021-01-21,Liebherr honoured with the SDEC 2020 Excellent Development Award
2021-01-19,"In case of imminent accident, new brake assistant for Liebherr wheel loaders reduces stopping distance"
2021-01-18,"From +5 to -86 degrees: Liebherr appliances ensure safe storage of vaccines, pharmaceuticals and research materials"
2021-01-18,Digitalization in deep foundation work: The positioning system LIPOS ® supports continuous flight auger drilling 
2021-01-15,Largest Liebherr material handling machine in France delivered 
2021-01-14,New alternative – fast telescoping using rope pull technology for Liebherr LTC 1050-3.1 compact crane 
2021-01-12,World class – Team Liebherr plays at the Santiago Bernabéu Stadium
2021-01-11,Wagstaff chooses 900 ton Liebherr LTM 1750-9.1 with new software upgrade for critical lift 
2021-01-11,Order for 33 G-BKF armoured recovery and crane vehicles for the Bundeswehr completed
2021-01-07,12 crawler excavators for HM-Entreprenør A/S
2020-12-22,Liebherr-Aerospace among the Best Suppliers of Embraer
2020-12-22,ATR 42/72 Entry into Service – Liebherr with New Air Management System on Board
2020-12-22,100 Liebherr PR 776 mining dozers commissioned
2020-12-22,One million units per year for the first time 
2020-12-22,Bay Ltd. to take delivery of 15 new Liebherr cranes by December 2020
2020-12-18,MacKellar Group adds to T 264 fleet in Australia
2020-12-18,Liebherr machines used for the construction of American landmarks
2020-12-17,Liebherr Awarded by AVL Powertrain UK to Supply Double-stage Electric Turbochargers
2020-12-16,LR 11000 from Felbermayr unloads 450 tonne generator from barge 
2020-12-14,Niederstätter expands sales and service activities for Liebherr tower cranes in Italy 
2020-12-10,Liebherr to Overhaul Landing Gears for Austrian Airlines
2020-12-10,Liebherr’s new 1110-5.1 – an all-rounder in action
2020-12-09,New alternative – using SPMTs as ballast trailers for Liebherr LR 11000 crawler crane
2020-12-08,"Lorban TP opts for performance, flexibility and comfort: Liebherr R 945"
2020-12-04,The Port of Grenaa goes for green e-drive
2020-12-03,When dreams come true - in the Liebherr Christmas bakery
2020-12-03,Nouvelle-Aquitaine Region: Generation 8 crawler excavators for various applications
2020-12-02,Liebherr at Zhejiang International Intelligent Transportation Industry Expo 2020
2020-12-02,Creating trust in the Caribbean – crane and heavy haulage contractor Força chooses Liebherr for used crane purchases 
2020-12-01,World Premiere: Three new Machines and one new Design
2020-11-30,"The 40,000th Liebherr mobile crane ever goes to Poland"
2020-11-26,Liebherr MK 88 Plus mobile construction crane in Rotterdam: cost-effective and quiet continuous operation using site power
2020-11-25,LTM 1050-3.1 makes “Muse” art project possible by hoisting a grand piano into a forest clearing
2020-11-24,Schuch expands fleet with three new Liebherr mobile cranes
2020-11-23,Liebherr Performance Days Europe: Real life meets virtual Tech Arena
2020-11-19,An investment for the future: Liebherr-Aerospace Toulouse receives new machine with Rotary Loading System
2020-11-19,Bridge-builder – LR 1800-1.0 links previously divided Berlin neighbourhoods of Moabit and Mitte
2020-11-18,“Expectations were high” – new LB Series in operation
2020-11-17,Extraordinary project – Liebherr 5-axle crane floated to site on a barge
2020-11-16,Space limited in Downtown Milan: Liebherr LTM 1350-6.1 convinces with Y-guying
2020-11-12,Liebherr heavy-duty crane loads monopiles
2020-11-12,Fleet modernised – LENZ-KRAN takes delivery of Liebherr LTM 1110-5.1 mobile crane
2020-11-10,Liebherr’s domestic appliances division publishes its third Corporate Responsibility Report
2020-11-10,BKL takes delivery of the very first LTM 1650-8.1 in Germany
2020-11-06,Manufacturing of Liebherr Heavy Lift Crane 150000-3000 for Alfa Lift reaches key milestone
2020-11-05,The journey of the stones 
2020-11-02,Securing the future: Liebherr in Deggendorf expands its training offer
2020-11-02,Modernisation – two new Liebherr mobile cranes for Würzburger Kranverleih
2020-10-30,World premiere: Liebherr presents the new generation of articulated dump trucks
2020-10-27,Liebherr Receives Award for Outstanding Performance in the ARJ21 Aircraft Program 
2020-10-27,Liebherr restores a 60-year-old wheel loader prototype: The LSL 1500
2020-10-27,One hoist instead of three – new boom system on the LR 11000 delivers greater efficiency
2020-10-23,Save the date: Digital world premiere of the new articulated dump truck
2020-10-22,Family outing: Four Liebherr K series cranes support bridge construction project
2020-10-22,Closing the gap – Schlamann takes delivery of Liebherr LTM 1060-3.1 mobile crane
2020-10-20,Increased hoist height and radius – Liebherr unveils a jewel for any crane fleet with the LTM 1150-5.3
2020-10-19,Mammoet takes delivery of first ever Liebherr LTM 1650- 8.1 mobile crane
2020-10-15,New top dog – Sommer invests in Liebherr LTM 1750-9.1 mobile crane
2020-10-14,"Liebherr USA, Co. adds Lincoln Klemola as new Manager of Field Services for its Mining division "
