date,제목
2023-05-15,Liebherr presents the new LH 26 M Timber Litronic at LIGNA 2023 in Hanover
2023-05-15,New Liebherr L 580 LogHandler XPower® makes its début at Ligna 2023
2023-05-10,ISO Limited and Liebherr advance New Zealand timber
2023-05-10,Liebherr wins ESTA Award in the 'Training' category
2023-05-04,Liebherr to exhibit at 2023 Elko Mining Expo
2023-05-04,Liebherr at Control 2023 - the international trade fair for quality assurance in Stuttgart
2023-05-03,Successful participation in MRO Americas 2023 
2023-05-03,Liebherr at LIGNA 2023: Special machines and solutions for the timber and forestry industry
2023-04-28,5 Liebherr assistance systems to keep you safe on your jobsite
2023-04-28,First LR 1400 SX in the Middle East for “The King of Barges”
2023-04-27,Liebherr cranes at work on Europe's first CO2-neutral thermal spa in Milan
2023-04-27,Three LR 1700-1.0 cranes for Canada – GUAY reinforces crawler crane fleet with Liebherr 700 tonne models
2023-04-26,Liebherr and ZF jointly develop high speed compressors
2023-04-25,Liebherr at the 2023 International Metro Transit Exhibition & Forum
2023-04-25,Rothmund strengthens crane fleet with Liebherr LTM 1450-8.1
2023-04-24,Top 5 takeaways from the Liebherr booth at Conexpo 2023 
2023-04-24,Liebherr’s highlights from 2022
2023-04-21,Liebherr-Aerospace & Transportation SAS successful in its first CDP and EcoVadis ratings
2023-04-21,Liebherr-Aerospace again among the Best Suppliers of Embraer 
2023-04-21,Liebherr power for the energy transition
2023-04-20,Premiere in the Port of Rostock: Sarens takes delivery of the first Liebherr LR 12500-1.0 crawler crane
2023-04-20,"Knock, knock. Who’s there?LRH 100.1 unplugged on first jobsite"
2023-04-19,Liebherr-Aerospace and REVIMA team up for A350 Nose Landing Gear MRO
2023-04-19,Liebherr among LinkedIn Top Companies Austria
2023-04-19,Fast-erecting crane from Liebherr works on former castle in historic old town 
2023-04-19,Liebherr LTM 1650-8.1: Reinforcement for Pergamo Sollevamenti
2023-04-18,"Liebherr presents the LR 1700-1.0W, the most powerful narrow track crawler crane on the market"
2023-04-18,Liebherr-Werk Bischofshofen GmbH launches state-of-the-art logistics centre
2023-04-17,Euro BTP joins the Liebherr Rental Alliance
2023-04-14,Liebherr 800-tonner expands Kuşgöz İzmir Vinç's crane fleet
2023-04-14,Charpe joins the Liebherr Rental Alliance
2023-04-13,LTM 1300-6.3 – A powerhouse over the rear 
2023-04-12,Liebherr cranes build sustainable office building at Luxembourg Airport 
2023-04-11,Liebherr to explore new technologies for hydrogen-powered aircraft
2023-04-11,Liebherr LTM 1650-8.1 mobile crane dismantles port crane 
2023-04-11,A career in mining: Thinking outside the box
2023-04-06,How Liebherr also inspires little ones: adventure playground opens in Ravensburger Spieleland 
2023-04-05,Doyle Shipping Group order hybrid RTG
2023-04-05,New Liebherr LTM 1650-8.1 is Błażej & Roman's largest crane
2023-04-04,Liebherr to exhibit at WasteExpo 2023
2023-04-03,Annual report 2022
2023-04-03,Liebherr: 2022 business year with new record turnover 
2023-04-01,Liebherr Group appoints new President and Vice President to its administrative board
2023-03-31,Mountain Crane takes delivery of the LR 1400 SX at Conexpo 2023 
2023-03-31,Liebherr presents gear cutting technology and automation systems at the CIMT in China
2023-03-30,Four aces for BKL: MK 88-4.1 and MK 140 cranes from Liebherr boost fleet
2023-03-30,Liebherr crane helps renovate historic building 
2023-03-29,Liebherr and China Airlines sign agreement on A321neo component support
2023-03-28,Liebherr-Aerospace awarded for its C919 landing gear system support
2023-03-28,ConcreArmado Ltda. orders LB 35 drilling rig at Conexpo 2023 
2023-03-28,"Farrell Design-Build, Inc. acquires the LRB 23 piling and drilling rig at Conexpo 2023"
2023-03-28,Big B Crane receives handover of multiple Liebherr Rough Terrain Cranes at Conexpo 2023
2023-03-28,Liebherr tower cranes expands in Lyon area
2023-03-27,"Liebherr-Transportation Systems receives EcoVadis ""Silver"" rating"
2023-03-23,Glenn Machine Works purchases a Liebherr LTM 1150-5.3 at Conexpo 2023
2023-03-23,"Duffy Crane & Hauling, Inc. adds a Liebherr LTM 1150-5.3 to expansive fleet "
2023-03-22,"Morrow Equipment Co., LLC adds multiple 125 K tower cranes to fleet at Conexpo 2023 "
2023-03-22,"Vergona Crane Co., Inc. purchases a Liebherr LTM 1150-5.3 at Conexpo 2023 "
2023-03-22,Liebherr-MCCtec GmbH remains sustainable at Gold Level
2023-03-21,LH 30 M delivered to Smith Industries at Conexpo 2023
2023-03-21,"Morrow Equipment Co., LLC expands fleet at Conexpo 2023 with multiple EC-B tower cranes"
2023-03-21,“The sky’s the limit”First LR 1400 SX in operation
2023-03-18,Liebherr delivers an L566 to the Colas USA at Conexpo 2023 
2023-03-17,Liebherr hands over the LTM 1100-5.3 to Skyline Crane Rental LLC at Conexpo 2023
2023-03-17,Bay Crane expands fleet of 500+ cranes at Conexpo 2023
2023-03-16,Liebherr successfully integrates HVAC units in passenger coaches
2023-03-16,Modernisation with innovative technology: Grúas Aguilar procures eleven new Liebherr mobile cranes
2023-03-15,"Sullivan Eastern, Inc. takes delivery of multiple Liebherr TA 230 articulated dump trucks "
2023-03-15,ML Crane Group expands large crane fleet with LR 1700-1.0 at Conexpo 2023
2023-03-14,Generation 8 crawler excavators at Conexpo 2023
2023-03-14,Liebherr’s biggest multipurpose crawler crane: LR 1400 SX
2023-03-14,Liebherr’s new models for deep foundation: LRB 23 and LB 30 unplugged
2023-03-14,Liebherr’s 125 K: The largest crane in a successful family
2023-03-14,"Liebherr 36 XXT truck mounted concrete pump at Conexpo 2023: Light, compact, flexible"
2023-03-14,The toughest in the roughest: Liebherr expands its rough-terrain crane range with the LRT 1130-2.1
2023-03-14,The master of all roads: New Liebherr LTM 1100-5.3 mobile crane 
2023-03-14,Powerful performance and impressive reach: the 470 EC-B flat-top crane from Liebherr
2023-03-14,Digital solutions: efficient processes for construction sites of the future
2023-03-14,Liebherr further expands its axial piston portfolio
2023-03-14,Digital clearance monitoring for slewing bearings
2023-03-14,Liebherr introduces H2 direct injection for heavy-duty combustion engines
2023-03-14,Liebherr to premiere its hydrogen prototype engine on the US market
2023-03-14,Conexpo 2023: Liebherr crawler and railroad excavators with fully automatic quick coupling system Solidlink
2023-03-14,At Conexpo 2023: Liebherr material handlers for scrap handling 
2023-03-14,Liebherr presents the new TA 230 Litronic articulated dump truck at Conexpo 2023
2023-03-14,Solidlink: New global brand name for fully automatic quick coupling system from Liebherr
2023-03-14,US premiere of the Liebherr PR 766 G8 at Conexpo 2023
2023-03-14,New Liebherr wheel loaders at Conexpo 2023
2023-03-14,Press kit: Conexpo 2023
2023-03-10,Liebherr participates in challenge for Vienna’s public transport operator 
2023-03-10,Denmark's leading recycling company relies on XPower® wheel loader from Liebherr
2023-03-10,Hybrid RTG retrofit for Baltic Hub
2023-03-10,"""The rooster sheave adds the last few centimetres"" "
2023-03-09,Liebherr receives seal as one of Germany's best employers 
2023-03-09,Hüffermann Krandienst: flat-top cranes from Liebherr prove their flexibility in use
2023-03-08,Sims Crane & Equipment takes delivery of LR 1250.1 unplugged
2023-03-07,"20,000 hours: Liebherr injectors convince in field test"
2023-03-07,Aaron Malueg: Becoming part of the Liebherr family
2023-03-07,Anthony Rooney: It’s in the details
2023-03-07,ONE-Dyas chooses LiMain remote maintenance
2023-03-06,Liebherr to exhibit at the 2023 ISRI Convention & Exposition
2023-03-06,Liebherr Indonesia’s first female technician
2023-03-06,100 per cent Liebherr: two new mobile cranes for Staas
2023-03-06,Solidlink: New global brand name for fully automatic quick coupling system from Liebherr
2023-03-03,Marcor Stevedoring closes contract on new LHM 800
2023-03-03,Wasel decides on two new Liebherr mobile construction cranes for further growth
2023-03-02,Jayson Cody: From start to finish
2023-03-02,The Liebherr R 945 G8 wows customer in New Caledonia
2023-03-02,Liebherr automates disassembly of battery packs
2023-03-01,Nine new Liebherr cranes for the next Wiesbauer generation
2023-03-01,Liebherr receives major order including new flagship for MSG Krandienst
2023-02-28,Focus on students: Liebherr and Hochschule Neu-Ulm University of Applied Sciences enter into strategic partnership
2023-02-27,Liebherr’s first battery-powered crawler crane in Asia
2023-02-24,First Liebherr LTM 1450-8.1 mobile crane in Serbia
2023-02-24,Liebherr-Aerospace at MRO Middle East 2023
2023-02-24,Four BOS-cranes shipped for gas project in Azerbaijan
2023-02-23,Sims Crane & Equipment takes delivery of LR 1250.1 Unplugged
2023-02-22,Liebherr-Aerospace at Heli-Expo 2023
2023-02-22,Thirteen T 236 confirmed for Nzema Gold Mine in Ghana
2023-02-16,Liebherr and Thiess join forces to strengthen presence in the Americas
2023-02-15,Liebherr slewing bearings ensure self-alignment of floating wind turbines
2023-02-14,Commissioning of second giant excavator for AMMAN
2023-02-10,RL 2600 crane shipped for DolWin epsilon platform
2023-02-09,"""On your site"": Liebherr at Conexpo 2023"
2023-02-08,Karunia invests in four Liebherr R 9300 mining excavators
2023-02-08,Liebherr laboratory mixers for the concretes of the future
2023-02-07,Assembly via helicopter: Liebherr flat-top crane at work on Mont Blanc 
2023-02-03,Liebherr crawler cranes from Grúas Aguilar erect retractable stadium roof 
2023-02-02,Boeing delivers last 747-8 – Liebherr-Aerospace is on board
2023-02-01,Interview: With mental flexibility to SmartMonitoring
2023-02-01,Liebherr-Aerospace at Aero India 2023
2023-02-01,Investing in the future: Schuch strengthens its fleet with Liebherr mobile cranes
2023-01-31,A continuing success story: Liebherr and GMVykon bring the first MK 88-4.1 to Mexico 
2023-01-30,Liebherr to unveil the future of freshness at KBIS 2023
2023-01-30,Liebherr HS 8100.1 duty cycle crawler crane utilized on Florida coast 
2023-01-30,Eurogate CTW to purchase two automated dual trolley STS cranes
2023-01-27,More sustainable air transport: Liebherr-Aerospace installs hydrogen test bench in its test center in Toulouse
2023-01-26,Delivery of first re-cored B747-8 ram heat exchanger
2023-01-24,Liebherr Concrete Technology to exhibit at the Precast Show 2023
2023-01-24,Right on track with Liebherr: 24 digital eyes for track construction giant
2023-01-24,Twin pack: Wille & Dulies takes delivery of two 5-axle mobile cranes from Liebherr
2023-01-23,Liebherr works together: LRT 1100-2.1 crane helps assemble Liebherr T 264 mining truck 
2023-01-23,"24 delivered, another 27 ordered: Al Faris grows with Liebherr mobile cranes"
2023-01-20,Longer and stronger: Schäfer takes delivery of a Liebherr LTM 1090-4.2 mobile crane
2023-01-20,After electrifying visitors at Bauma: What's next for the Battery-Electric Arocs truck mixer?
2023-01-19,Last crane finishes work on the Spin Tower in Frankfurt
2023-01-19,Salerno Container Terminals relies on additional LHM 600 to strengthen fleet
2023-01-18,Interview: Back to the future – the development of the LICCON crane control system
2023-01-16,Liebherr completes lift height extension of STS in Australia and announces new Liebherr-Transform project in USA
2023-01-10,New in Lindau and Biberach: Liebherr-Electronics and Drives GmbH
2023-01-10,Pick & carry – Eineder uses Liebherr LTR 1060 telescopic crawler crane in solar farms 
2022-12-20,Liebherr systems fly with ARJ21 aircraft
2022-12-19,An LTM 1250-6.1 helps renovate the largest church in Hungary 
2022-12-19,Mònica is back home:LTC 1050-3.1 mounts restored bell in La Seu Vella Cathedral
2022-12-16,Joryf expands crane fleet with 220 EC-B 10
2022-12-15,Liebherr breaks ground for new hydraulic cylinder plant in Oberopfingen
2022-12-14,Railway industry in China: Liebherr expands its own market access
2022-12-12,The order from the far north
2022-12-09,Liebherr large order: WASEL invests 60 million euros
2022-12-09,Entry into Service: Liebherr-Aerospace on board the C919
2022-12-08,LiMain remote maintenance showcased live
2022-12-08,Faster rail travel: Liebherr cranes help build the Filstal Bridge 
2022-12-07,Successful business deal at Bauma 2022: LEONHARD WEISS orders ten Liebherr railroad excavators
2022-12-07,Monnis and Liebherr finalised substantial supply contract at Bauma 2022
2022-12-07,“There’s no getting around the LTM 1650-8.1”
2022-12-06,Liebherr supports safety simulations at US operations
2022-12-06,“On Your Site” with 16 new Liebherr cranes
2022-12-05,Liebherr apprentice successful at WorldSkills 2022 
2022-12-05,18 Liebherr mobile cranes for Saudi Arabia: GHHL signs contract at Bauma
2022-12-01,Ten Liebherr tower cranes are helping to build the largest timber campus in Europe
2022-11-30,Nine axles for Saudi Arabia: Bin Quraya adds an LTM 1750-9.1 to its crane fleet
2022-11-29,Eight new cranes in eight years: Rahlf strengthens fleet with an LTM 1160-5.2
2022-11-29,Using lava stones in cooling and freezing facilitates a quantum leap in energy efficiency
2022-11-29,Relive the best exhibition moments with the Bauma image film
2022-11-28,"Liebherr's LTM 1650-8.1: ""A sensational machine"""
2022-11-25,Bauma: ESEASA orders seven new Liebherr mobile cranes
2022-11-23,"Cranes up to 1,350 tonnes lifting capacity: Schmidbauer orders from Liebherr"
2022-11-17,WAE and Liebherr pay tribute to their joint zero emissions work at Bauma 2022
2022-11-17,"Liebherr cranes help build Edeka campus in Minden, Germany"
2022-11-15,Port Canaveral acquiring second LHM 600
2022-11-11,ATLAS expands crane fleet at Bauma 2022
2022-11-10,Liebherr Receives Supplier of the Year Award from COMAC
2022-11-09,In the middle of the construction site of the century
2022-11-08,Two mobile construction cranes from Liebherr go to South Korea 
2022-11-08,Port of Arendal adds LHM 550 with E-Drive
2022-11-08,When a Bauma visit turns into a spontaneous major order
2022-11-07,Increasing the load: Locar expands its fleet and its load capacity with a new Liebherr LTM 1750-9.1 
2022-11-07,ESB Kranverleih now also uses a mobile construction crane from Liebherr
2022-11-04,Missed Bauma? No problem! Experience Bauma again with the video magazine
2022-11-04,Focus on partners and customers: Liebherr tower cranes draws a positive balance of Bauma
2022-11-03,All from one source: Stagakis Ltd. signs rental and service partner agreement at Bauma
2022-10-30,From Bauma to the US: Michels Construction takes over five Liebherr drilling rigs
2022-10-30,Liebherr mobile construction crane handed over for Galabau
2022-10-30,Liebherr trainees go Bauma
2022-10-30,Simon Ebner: from visitor to expert for hydraulic cylinders
2022-10-29,Engines for every application: Liebherr showcases innovative solutions at Bauma
2022-10-29,Inmaculada Montero Ruiz: Always keeping an eye on Liebherr at Bauma
2022-10-29,Proven partners: Liebherr welcomes Morrow Equipment at Bauma 
2022-10-29,Plan your career with Liebherr at Bauma
2022-10-29,Partners meet: Table tennis president visits Liebherr at Bauma
2022-10-29,Ümit Arici: A bridge between childhood and adulthood
2022-10-28,JST Services and Liebherr celebrate 20-year partnership at Bauma
2022-10-28,Joel Jensen: An Australian at Bauma
2022-10-28,Liebherr and Grúas Cono Sur to cooperate in Chile under new Rental Partner Agreement 
2022-10-28,MAXIKraft places mega order with Liebherr
2022-10-28,Discovered at the booth: virtual worlds meet concrete mixing plants
2022-10-28,Ready for the Cuban market: Liebherr and Metallica Caribbean sign dealer agreement
2022-10-28,Nadine Vallaster: When the heart beats digitally
2022-10-28,Armofer expands fleet with an R 980 Demolition 
2022-10-28,Digitalisation: Liebherr-EMtec meets lead customers at the booth
2022-10-27,Nice sounds at Bauma: Ellis Crane Hire underlines machine handover with music
2022-10-27,From Bauma to the Netherlands: Battery-powered crawler crane for Bultena Verhuur
2022-10-27,Liebherr welcomes local politicians from the Alb-Donau district at Bauma 
2022-10-27,Bigge’s Perfect Fleet is growing bigger with new Liebherr models!
2022-10-27,70 in one sweep: Hüffermann expands fleet with additional Liebherr cranes
2022-10-26,Jasmin Ege: Passing on the enthusiasm for Liebherr products
2022-10-26,MyLiebherr customer portal: New functions for Bauma 2022 and beyond
2022-10-26,MP Levage adds a MK 88-4.1 to its fleet of machines
2022-10-26,Alternative drives and product responsibility: Liebherr showcases solutions in InnovationLab
2022-10-26,Liebherr hands over 36 XXT truck-mounted concrete pump with special look to BPU
2022-10-25,"François Jaussi: When we love, we do not count"
2022-10-25,Seven new truck mixers for INZAG Germany GmbH 
2022-10-25,At Bauma: Liebherr HTM truck mixer goes to Unicon
2022-10-24,Deputy Bavarian Minister-President Hubert Aiwanger visits Liebherr at Bauma
2022-10-24,Bauma 2022 has started: Official trade fair tour visits Liebherr booth
2022-10-24,Karunia and Liebherr commemorate their partnership at Bauma 2022
2022-10-24,Liebherr employees celebrate the start of Bauma 2022
2022-10-24,Press kit: Bauma 2022
2022-10-24,Liebherr unveils fleet data management for mobile and crawler cranes
2022-10-24,The master of all roads: New Liebherr LTM 1100-5.3 mobile crane 
2022-10-24,The toughest in the roughest: Liebherr expands its rough-terrain crane range with the LRT 1130-2.1
2022-10-24,The new 70 to 100 tonne crawler excavators from Liebherr
2022-10-24,Liebherr Mining details latest technology updates at Bauma 2022
2022-10-24,Liebherr unveils R 9300 mining excavator at Bauma 2022
2022-10-24,Liebherr shows first luffing jib crane with fibre rope technology at Bauma 2022 
2022-10-24,Bauma 2022: New Liebherr 520 EC-B crane with fibre rope
2022-10-24,Bauma 2022: Product highlights and innovations at Liebherr earthmoving and material handling machines
2022-10-24,The new all-rounder from Liebherr: duty cycle crawler crane HS 8070.1
2022-10-24,Workout with 100 tonnes: the new LR 1100.1 from Liebherr
2022-10-24,Outstanding: the LR 1400 SX is the tallest exhibit at the Liebherr stand
2022-10-24,LRB 23 continues the success story of piling and drilling rigs for Liebherr
2022-10-24,Liebherr’s most powerful standard crane at Bauma 2022: The 1188 EC-H high-top crane with fibre rope 
2022-10-24,Future alternatives: Three types of low-emission drive for Liebherr telescopic handlers
2022-10-24,Bauma 2022: Live Première of the Liebherr PR 766 G8
2022-10-24,Liebherr at Bauma 2022: Digital solutions and smart assistance systems 
2022-10-24,Liebherr’s most powerful standard crane at Bauma 2022: The 1188 EC-H high-top crane with fibre rope 
2022-10-24,Liebherr presents upgraded MK 140-5.1 at Bauma 2022 
2022-10-24,MyJobsite - the digital solution from Liebherr for the deep foundation sector
2022-10-24,The Liebherr R 950 Tunnel-E: an electric crawler excavator with cable and battery-powered mobility kit
2022-10-24,Liebherr crawler concrete pump for special civil engineering at Bauma
2022-10-23,Liebherr hydrogen excavator receives Bauma Innovation Award
2022-10-23,World premiere: Liebherr debuts crawler excavator with a hydrogen engine
2022-10-23,8 things you shouldn’t miss from Liebherr at Bauma 
2022-10-22,5 things you may not have known about the R 9XX H2 crawler excavator with hydrogen engine 
2022-10-21,Liebherr-Aerospace at Aero MRO India Aerospace & Defence 2022
2022-10-21,Liebherr: Winner of the Red Dot Award for brand design
2022-10-21,5 things you may not have known about the Trolley Assist System
2022-10-20,Liebherr and AMETEK MRO AEM cooperate on E-Jet E1 landing gear overhaul
2022-10-20,5 things you may not have known about the new 258 HC-L 10/18 Fibre luffing jib crane
2022-10-19,Bauma and Liebherr: How it all began 
2022-10-19,5 things you shouldn’t miss from Liebherr careers at Bauma
2022-10-19,Port of Dover operates Liebherr LHMs powered by HVO 100
2022-10-18,Premiere at Hydrogen Technology Expo Europe 2022
2022-10-18,5 things you may not have known about Bearing Clearance Monitoring
2022-10-17,Liebherr further expands its axial piston portfolio and introduces a concept study
2022-10-17,5 things you may not have known about the 110 D-K crawler concrete pump
2022-10-17,Seghetti adds a used Liebherr LTM 1100-4.2 mobile crane to its fleet
2022-10-16,6 historical pictures of Liebherr at Bauma that you have never seen before
2022-10-15,5 things you may not have known about the LICCON3 crane control system
2022-10-14,5 things you may not have known about the LR 1400 SX crawler crane
2022-10-12,"All-electric LS 800 E ship cranes for SAL ""Orca"" project"
2022-10-12,Liebherr hydraulic cylinders: just a mouse click away
2022-10-11,Liebherr: Technology-neutral drive concepts for the future
2022-10-10,Liebherr to premiere its hydrogen prototype engines at Bauma 2022
2022-10-07,Liebherr-made grease for pitch and azimuth bearings
2022-10-06,Fleet modernization: Grúas Roxu procures ten Liebherr mobile cranes
2022-10-04,How does a material handling machine come to be?
2022-10-04,Liebherr and Sung Shin Rolling Stock Technology sign Memorandum of Understanding
2022-10-03,Liebherr-Aerospace at MRO Europe 2022
2022-09-30,Liebherr Refrigerators and Freezers launches online parts and accessories store 
2022-09-30,C919 receives CAAC type certification with Liebherr technology on board
2022-09-30,How does a Liebherr crawler crane get to Bauma?
2022-09-29,Liebherr-Singapore expands its Aerospace MRO capabilities
2022-09-29,360° for 100% comfort: Liebherr surround view system for mobile machines
2022-09-29,Liebherr presents new LH 26 M Timber Litronic timber truck
2022-09-28,HLC 295000: Swift and capable
2022-09-28,Where steel ends: Clear the stage for Liebherr’s hybrid solutions in lightweight construction
2022-09-27,When the fascination for technology becomes a profession 
2022-09-27,Concrete mixing plant as a modular system: With modular solutions on the construction site
2022-09-27,Liebherr crane on the hook
2022-09-23,"Two experts, one product: Drive technology and digitalization around the LR 1700-1.0"
2022-09-23,Liebherr drive technology – joining the electrification trend
2022-09-23,Liebherr sending three additional LHMs to Noatum terminals in Spain
2022-09-22,Liebherr presents new 55 kW compressor
2022-09-21,Comfortable rides for commuters in Chicago
2022-09-21,"Dream big, work hard, make it happen: the first woman driving Panama’s biggest mining truck"
2022-09-21,Unplugged or conventional: it all depends on the construction site
2022-09-21,Five new Liebherr flat-top cranes for Otto Wulff 
2022-09-19,Liebherr shows rail-road excavator for track construction at InnoTrans
2022-09-15,Electrification and lower emissions: Exhibits of Liebherr at InnoTrans
2022-09-15,182 Liebherr air-conditioning units for Czech Railways
2022-09-15,First R 980 SME shovel in France
2022-09-14,Simply strong: safe and efficient force-measurement within Liebherr hydraulic cylinders
2022-09-13,Active personnel detection for Liebherr wheel loaders receives 2022 VDBUM Award
2022-09-12,Wind main bearing: new single-row tapered roller bearing
2022-09-09,HVAC units from Liebherr successful in passenger operations
2022-09-08,North France: Liebherr crawler excavators with numerous application possibilities
2022-09-07,Liebherr-Aerospace at MRO Asia-Pacific 2022
2022-09-07,Liebherr introduces H2 direct injection for heavy-duty combustion engines
2022-09-06,Double pack complete: Guindastes Tatuapé receives its second LTM 1120-4.1
2022-08-30,The beginning of a new era
2022-08-30,Liebherr automation systems at The Battery Show North America
2022-08-30,Always on track for progress: Liebherr at InnoTrans 2022
2022-08-30,First Liebherr LTM 1650-8.1 in Saudi Arabia goes to ACT 
2022-08-26,Liebherr Transform: unleash the full potential
2022-08-22,New all-electric heavy lift ship crane
2022-08-22,Flexibility on eight axles: Colonia takes over Liebherr LTM 1650-8.1 mobile crane
2022-08-19,Jandt expands crane fleet with Liebherr LTM 1150-5.3 mobile crane
2022-08-18,Road construction in Africa: INZAG procures Liebherr LTM 1090-4.2 mobile crane for Ghana
2022-08-12,It takes two to tango
2022-08-12,Liebherr-Verzahntechnik GmbH at AMB in Stuttgart
2022-08-08,Liebherr gear technology and automation systems at IMTS in Chicago
2022-08-08,"Environmentally friendly CO2 air conditioning system from Liebherr successfully tested in ""eco2jet"" research project"
2022-08-05,Liebherr Mining’s Perth facility expands for new technologies and zero emission progress
2022-08-03,182 metre-high skyscraper: New Liebherr crane at work in Canada 
2022-08-02,Alpine crane job on constricted site
2022-07-29,Two new Liebherr mobile cranes for Poloniato
2022-07-28,170 metre office tower – Liebherr cranes involved in construction of “To‑Lyon”
2022-07-26,Successful test of Liebherr air-conditioning unit for Etihad DMU project 
2022-07-26,Herkules strengthens crane fleet with Liebherr-LG 1750 lattice boom mobile crane
2022-07-20,Liebherr to supply first complex 3D printed component for Airbus’ A350 fleet
2022-07-20,"""Perfect in halls"": LTC 1050-3.1 is impressive indoors too"
2022-07-19,Liebherr-EMtec GmbH drives digitisation forward together with customers
2022-07-18,Double pack: Henneberger Schwerlast takes delivery of two new Liebherr mobile cranes
2022-07-15,New 300 EC-B 12 Fibre and 270 EC-B 12: EC-B series from Liebherr continues to grow 
