뉴스구분,날짜,링크,제목,요약,본문
By Press Information,6/13/2019,https://www.volvoce.com/global/en/news-and-events/press-releases/2019/jannicke-serneberg-appointed-manager-of-munktell-museum/,JANNICKE SERNEBERG APPOINTED MANAGER OF MUNKTELL MUSEUM,"With effect from September 1st Serneberg will oversee Volvo CE’s Munktell Museum of historic machines – which attracted more than 28,700 visitors last year.","Jannicke Serneberg has been appointed Manager of the Munktell Museum in Eskilstuna, which is owned and run by Volvo Construction Equipment (Volvo CE). With effect from September 1st 2019, she will be managing the daily operations of the museum. Jannicke joins the museum at an important time and will drive its future development. 
  Jannicke will succeed Leif Anväg, who is set to retire but will be managing the museum until the handover, with the support of deputy manager Tomas Lindberg. Based in Eskilstuna, Jannicke will report to Bill Law, Senior Vice President of Corporate Communications and Public Affairs at Volvo CE. 
  “I am very excited about this new challenge,” comments Jannicke. “The Munktell Museum is a true jewel in Volvo CE’s crown globally, not to mention consistently ranking in as the number one visitor attractions in Eskilstuna itself. It is a great platform to engage with both the company’s customers and the public. I am looking forward to working with an exceptional and dedicated team of volunteers who do such a great job at keeping the musem an active part of the community, giving visitors an understanding how these historic machines helped shape the world we live in today.”
SWEDEN’S INDUSTRIAL HERITAGE
The collection of the Munktell Museum consists of approximately 200 objects of which about 90 historic vehicles are available to see in the museum.
The Munktell Museum exhibits more than 180 years of Swedish industrial history and welcomed more than 28,700 visitors in 2018. With a great reputation globally, the museum has steadily grown its visitor numbers – up 40% in the last decade. Among the many rarities on display are the first Volvo CE wheel loader, the first Swedish tractor – built in 1913 – and the world's first mass-produced articulated hauler. 

Johan Theofron Munktell, a Swedish industrialist, opened his first mechanic workshop in Eskilstuna in 1832 and later merged his business with the company of the brothers Jean and Carl Gerhard Bolinder, laying the foundation for Volvo CE. As well as a custodian of history, today the museum is also used for conferences and dinner events and welcomes thousands of visitors to the international Volvo Days, the company’s most popular customer event, which is dedicated to demonstrating new products to customers and dealers. 

“I am delighted to welcome Jannicke to her new role. With her many years of experience of working at Volvo CE, her passion for customer service and her ability to manage and develop a team, I know that she will lead the museum to a bright future,” comments Bill Law. “Jannicke will take over from Leif Anväg, who has done an incredible job and reinforced the museum as a well-loved part of the local community. I want to thank him for all his hard work and dedication.” 
LONG-TERM EMPLOYEE OF VOLVO CE
Jannicke has been working for Volvo CE for more than 16 years and started her career at the company’s central refill team in Eskilstuna in 2003. Previously, Jannicke was Director for Volvo CE’s Parts and Attachments Logistics department in the EMEA region. In this position she was responsible for customer support, logistics development, transport follow-up and order handling for spare parts. Outside of work, Jannicke is an active member of Eskilstuna’s theatre group, both on stage and behind the scenes and has been handling the group’s marketing activities for many years. "
By Press Information,5/23/2019,https://www.volvoce.com/global/en/news-and-events/press-releases/2019/volvo-ce-and-sdlg-take-next-step-in-china/,VOLVO CONSTRUCTION EQUIPMENT AND SDLG TAKE NEXT STEP IN CHINA,"Volvo Construction Equipment (Volvo CE) and SDLG will further extend its cooperation to accelerate the profitable growth journey. As of December 2020, all excavators from 15 tons made for the Chinese market will be consolidated into one product line based on the latest Volvo technology and Volvo branded.","Volvo CE and SDLG are currently manufacturing and selling their own separate excavator product lines in China. In order to further accelerate growth in conjunction with the upcoming China IV emission standards, all excavators from 15 tons for the Chinese market will be consolidated into one product line by December 2020. The products will be based on the latest Volvo technology and branded Volvo. 
  Since Volvo CE acquired 70% of SDLG in 2007, net sales have grown from approximately SEK 3 billion to SEK 17 billion with good profitability. SDLG has a strong market position in wheel loaders and has successfully entered the excavator market with technological support from Volvo CE.
  “Bringing our larger excavator businesses in China together will maximize our ability to serve customers in China,” comments Melker Jernberg, President of Volvo Construction Equipment. “SDLG has been a great success since we began our cooperation in 2007. With sales of both brands growing and our cooperation getting ever closer over the years, this is a natural next step for us.”
Journalists who would like further information, please contact: Bill Law, SVP Corporate Communications +46 31 323 84 96"
By Press Information,5/9/2019,https://www.volvoce.com/global/en/news-and-events/press-releases/2019/new-exhibition-celebrates-machines-of-the-future-built-in-lego-bricks/,NEW EXHIBITION CELEBRATES MACHINES OF THE FUTURE – BUILT IN LEGO BRICKS,"Through a series of visionary LEGO models designed by fans of all ages, exclusive exhibition FutuRE:BUILD reveals the imaginative power of machine technology – opening tomorrow at London Transport Museum.","What will the construction machines of the future look like? And how will they perform? After inviting members of the public from around the world to come up with their own inventive concepts, Volvo Construction Equipment (Volvo CE) and LEGO® Technic are displaying the incredible results for the first time in FutuRE:BUILD. This exclusive exhibition is coming to London Transport Museum in the heart of Covent Garden, London, from May 10th – 16th.
  Highlighting the technical ingenuity of budding engineers young and old, the many entries have been whittled down to the top 10 models chosen by a panel of judges. Together they showcase a broad spectrum of technologies, including driverless automation, 3D printing, solar panels and drones. Inspired by the futuristic vision behind the LEGO® Technic Volvo Concept Wheel Loader ZEUX – entrants were asked to build their own models using at least 50% existing LEGO® Technic bricks. And once the wheels were set in motion, the public’s imaginations went wild.
  Arvid Rinaldo, (Brand Communication & Partnerships) at Volvo CE, says: “We were overwhelmed with just how far people went with their creations. The best-in-show were picked because they prove that the boundaries of our future construction machines are seemingly limitless. Some of these designs look like they have come straight out of a sci-fi movie. We are at an exciting point in time for the industry and these models are actually not too far removed from what could be coming to our construction sites of the future.”
  The sheer breadth of concepts on display serve as inspiration to future generations of engineers.
  Runner up prize-winning model Volvo ICARUS, by James Cox, is a mobile solar power plant with advanced off-road capabilities.
The grand prize winner – Transylvanian native Vida András – is a 27-year-old Romanian architect who was inspired by the challenge of finding an environmental solution to construction machines and presenting that in the most elegant way. His self-driving model, the Volvo Rottweiler is fitted with a pneumatic drill, a dozer and a 3D printer – making it capable of autonomously taking on any construction challenge in the most hard-to-reach places.

He says: “To me, the design is not just about playability, it’s about really exploring the potential for future technologies. In my industry, 3D printing is one of the biggest trends at the moment, so I wanted to incorporate that into my model. I have 20 years’ experience playing with LEGO sets. I’ve loved it forever and have always had this confidence that I could sit down and build for hours and eventually it would all come together in the end.”
Runner up prize-winning model Volvo Excavadrone, by Marco Pirola, works on both land and in the air.
A panel of judges, including members of LEGO® Technic and Volvo CE, critiqued the entrants on a number of factors: overall coolness and originality, most inspired details, relevance to the contest theme and best use of LEGO elements. A truly diverse competition, winners range in ages from 14 to 47 and come from all corners of the globe from the UK to Hungary and the USA to South Africa. Other models on display include Volvo ICARUS, a mobile solar power plant with advanced off-road capabilities, and The Volvo Excavadrone built to operate on land and in the air.

Sam Mullins, Director for London Transport Museum, says: “We’ve all enjoyed the imaginative play of LEGO bricks and I am sure our visitors will be thrilled to see these fantastic, futuristic creations. As well as offering a great day out, one of the key things we do at London Transport Museum is to turn childhood enthusiasm into a career in engineering. These driverless diggers will certainly inspire young minds. And budding young inventors should also pop into our Future Engineers gallery after exploring the new FutuRE:BUILD exhibition.”"
By Press Information,5/8/2019,https://www.volvoce.com/global/en/news-and-events/press-releases/2019/volvo-ce-scoops-two-awards-at-brand-film-festival-london/,VOLVO CE SCOOPS TWO AWARDS AT BRAND FILM FESTIVAL LONDON,Volvo Construction Equipment (Volvo CE) takes silver and bronze prizes at PR Week’s Brand Film Festival awards in London.,"Volvo CE’s excavator film Pump It Up won silver for its viral creativity at the Brand Film Festival awards on May 1, while their Volvo Concept Wheel Loader ZEUX in collaboration with LEGO® Technic claimed bronze. 
  Pump It Up was the launchpad for Volvo CE’s Excavator For Any Challenge campaign – a brand initiative to boost awareness of Volvo CE’s excavator offering to a wider consumer audience. To do that, the film needed to be fun, funky and on point to an audience who knew little or nothing about construction equipment. With currently over 50 million views, the film surpassed even the wildest expectations, going truly viral as well as appearing in printed media around the world. The campaign is being supported by an ongoing series of marketing initiatives, aimed at boosting Volvo CE’s market share of the global excavator market.
  Revealing the toughness and intelligent engineering behind Volvo’s full range of excavators, the film tests the limits of heavy equipment during an exhilarating and entertaining army boot camp, led by mean drill instructor Dolph Lundgren.
FUTURISTIC FUN
The Volvo Concept Wheel Loader ZEUX came about following a number of fun and informal team building workshops in Billund, Denmark, the home of LEGO® Technic.
The result was a game-changing model that combines automation and drone technology. The model itself then went on to influence the creation of a number of potentially revolutionary patents for the construction industry.
“We are thrilled to accept these awards. A team of Volvo marketeers, operators and designers worked seamlessly to make these ideas come to life. Some of the stunts in Pump It Up, like the pull-up exercise, have never been attempted before on screen,” said Mats Bredborg, Head of Brand and Market Communication for Volvo CE.
“I’m very proud of all the hard work that the teams put in. We look forward to another year of successful projects at Volvo CE.”"
By Press Information,5/2/2019,https://www.volvoce.com/global/en/news-and-events/press-releases/2019/ann-sofie-raftegard-appointed-head-of-hr-at-volvo-ce/,ANN-SOFIE RÄFTEGÅRD APPOINTED HEAD OF HR AT VOLVO CE,"With effect from October 1, 2019 latest, Ann-Sofie Räftegård will take up the role of Senior Vice President, Human Resources at Volvo Construction Equipment (Volvo CE).","Räftegård will lead Human Resources by driving talent management, compensation and benefits, workforce planning, diversity and engagement of Volvo CE’s global workforce of over 14,000 people. She will report to company President Melker Jernberg and be a member of the Executive Management Team (EMT). 
  ‘I am very excited to join the Volvo Group and Volvo Construction Equipment. Besides joining a recognized and interesting company and brand, I see myself joining a journey and an industry in transformation with endless opportunities to connect people and business for success. That is what inspires me!’, comments Räftegård.
  She joins Volvo from having spent more than three years at the Swedish Höganäs Group, where she was Senior Vice President of Human Resources. Prior to that Ann-Sofie has held important roles at IKEA, Daimler/Mercedes Benz, Johns Manville and Perstorp.
  Ann-Sophie is bilingual in Swedish and English and holds a degree and diploma as a Gestalt Practitioner in Organisation from the Stockholm Gestalt Academy in Sweden. She also has a degree in Human Resource Management from Växjö University, in Sweden.
  Ann-Sophie will be based in Gothenburg, Sweden. She replaces Diana Niu, who took up the role of Executive Vice President of Human Resource Management for the Volvo Group from 1 January 2019.
  Volvo CE President Melker Jernberg comments, “I am delighted to welcome Anne-Sophie to her new role. I know she will make a very strong contribution to our company at this important time for the business.”"
By Press Information,4/29/2019,https://www.volvoce.com/global/en/news-and-events/press-releases/2019/volvo-s-electric-excavator-helps-build-the-morgan-stanley-garden-at-iconic-rhs-chelsea-flower-show/,VOLVO'S ELECTRIC EXCAVATOR HELPS BUILD THE MORGAN STANLEY GARDEN AT ICONIC RHS CHELSEA FLOWER SHOW,The construction of the Morgan Stanley Garden – one of this year’s main show gardens at the global consumer showcase – will be the first major project for Volvo’s new electric ECR25.,"Highlighting the machine’s unique capabilities for inner city environments and in keeping with the garden’s aims to explore how beautiful gardens can be created with a lighter environmental footprint, the zero emissions compact electric excavator will begin breaking ground on the foundations for the garden today (April 29). It marks its very first job since it was unveiled to a global audience earlier this month.
  Designed and created by garden designer Chris Beardshaw, The Morgan Stanley Garden considers how resources can be managed more sensitively throughout the creation of the show garden. Chris and his team have sourced a range of environmental materials and building methods to create this year’s garden – the start of which will be the ECR25 Electric.
  Chris says: “We are incredibly proud to debut Volvo’s electric excavator during the creation of this year’s garden. RHS Chelsea Flower Show offers the perfect arena to showcase the machine because it is such an intense work zone right in the heart of London so reducing exhaust emissions and lowering the noise levels is an absolute game changer.”
  The machine will be working hard over the next week and a half where it will be excavating the site and trenching for tree pits and a central water feature. Once the job is complete it will then be moving on to its next big project where it will be used in one of the first customer pilots for Volvo CE’s electric compact product range.
The zero-emissions compact excavator, the first in Volvo’s pledge to commit to a line of electric compact machines, at its launch in bauma.
Because the machine is electric, no particulate matter, nitrogen oxide or carbon dioxide is released into the environment. In addition to zero exhaust emissions, it also delivers significantly lower noise levels, reduced energy costs, improved efficiency and less maintenance requirements, compared to its more conventional diesel counterparts. Capable of operating for eight hours of work at a time, it will be charged overnight using the show’s electricity grid.
Ahcène Nedjimi, Electromobility Specialist at Volvo CE, says: “What greater way to showcase the true potential for electric machine technology than on this global platform. Volvo CE has always been committed to delivering zero emissions in the construction industry and now we are fulfilling this promise with a machine that represents a brighter future not only for our industry, but for society as a whole. This exciting project is the best possible demonstration of how we are driving forward sustainable innovations with our partners across any and every task, big and small.”
There are more than 157,000 visitors set to attend the five day-long RHS Chelsea Flower Show when it opens to the public on Tuesday, May 21 – all of whom are there to see cutting-edge garden design and the latest horticultural trends. Designer Chris Beardshaw has a strong reputation at the event, having received seven Gold Medals and four BBC People’s Choice Awards and last year was awarded Best in Show for The Morgan Stanley Garden for the NSPCC (UK children’s charity).
And this year’s garden in the heart of London is a fitting setting for Volvo’s cleaner, quieter and more efficient machine.
Find out more about our electromobility journey!"
By Press Information,4/24/2019,https://www.volvoce.com/global/en/news-and-events/press-releases/2019/sales-up-15-per-cent-in-volvo-ce-s-first-quarter/,SALES UP 15% IN VOLVO CE'S FIRST QUARTER,"Growth in most major markets helped Volvo Construction Equipment deliver a solid first financial quarter 2019, with sales up 15% and profitability up 26%.","Stable market conditions in most regions helped propel Volvo Construction Equipment (Volvo CE) to a solid set of financial results in the first quarter of 2019, with the company posting good growth in sales, profitability and machine deliveries. 
During the first three months of 2019 Volvo CE saw net sales jump by 15% to SEK 24,155 M (SEK 20,914 M in Q1 2018). These higher sales, plus improved prices and product mix, helped to positively impact operating income, which rose to SEK 3,646 M, up over a quarter (26%) compared to the SEK 2,888 M posted in the first quarter of 2018. This was reflected in operating margin, which also saw strong improvement, at 15.1%, compared to 13.8% in the same period the year before.
Deliveries were also up 5% during the period, to 23,139 machines, compared to 22,102 machines in Q1 2018.
MARKET DEVELOPMENT
The major global construction equipment markets of Europe and North America both saw growth in the first quarter, growing 3% and 4% respectively in the first two months of the year. The European market was driven by good demand from Germany, the UK and Italy, while growth in North America was boosted by growing demand for large wheel loaders, road equipment and articulated haulers. A recovering Brazil helped demand in South America rise by 5% during Q1, while Asia (not including China) slipped 4% compared to the same period last year. China, meanwhile, delivered stronger demand than expected, rising 23% compared to the first quarter of 2018. 

“The global market for construction equipment remained good in the first quarter,” commented Volvo CE’s President Melker Jernberg. “We are successfully managing these increases in volumes, and this good cost control is helping to deliver encouraging levels of operating income and operating margin.”
Table 1. Volvo Construction Equipment, net sales by market area, in Millions of Swedish Krona"
By Press Information,4/23/2019,https://www.volvoce.com/global/en/news-and-events/press-releases/2019/building-a-new-wonder-of-the-world/,BUILDING A NEW WONDER OF THE WORLD,"With severe overcrowding putting pressure on the iconic city of Cairo, Egypt, the answer is simple: build a new capital city next to it.","In the seventh episode of The Megaproject Listing, Volvo Construction Equipment (Volvo CE) explores the ambitious construction of a new metropolis outside the sprawling urban center of Cairo – a $45 billion project that will soon be home to five million people, making it the largest purpose-built capital in human history.
  Cairo has been Egypt’s capital for 1,000 of the country’s 5,000 year history, is located close to some of the world’s most renowned and ancient heritage sites and is currently home to some 23 million citizens – more than a fourth of Egypt’s entire inhabitants. The city’s dense population has created some of the worst traffic congestion in the world, with the average citizen spending anywhere from four to five hours stuck in traffic every day. And the problem is only set to worsen as the population is projected to reach 40 million by 2050. The government’s solution is simple: move the capital. 
  In this episode released today, Volvo CE will showcase its role in building the new capital. The city will stretch over 700 km2 – about the size of Singapore – and have 21 residential districts, 2,000 schools and colleges as well as 1,250 new mosques and churches. It will also be the first smart city in Africa, with solar parks and electrified transportation. In a country where 96% of the population are crammed into 4% of the land – a new city of this stature next to a treasure trove of valued antiquities is a welcome addition.
  Volvo machines building Egypt's new capital.
Egypt’s ancient construction feats are still marveled at today. But unlike The Great Pyramids of Giza – which took an estimated 85 years to build – this modern-day megaproject has risen from the sands in record time. Construction of the new capital began in 2017 and is set to be completed in 2022. Furthermore, most of the government buildings are scheduled to move into the new city as soon as June this year. 

Tiffany Cheng, Global Director, External Communications, at Volvo CE, said: “This new city will change the lives of literally millions of people – making a positive impact on its people, families and workers not only for the next few years but for generations to come. And with sustainable developments such as solar parks and electric transportation, this project will stand as an example of urban planning at its best.”

For further information and to see these films, please visit www.volvoce.com/global/en/spirit-magazine/egypts-new-wonder/"
