뉴스구분,날짜,링크,제목,요약,본문
By Press information,5/25/2022,https://www.volvoce.com/global/en/news-and-events/press-releases/2022/volvo-construction-equipment-world-rx-rallycross-tracks/,VOLVO CONSTRUCTION EQUIPMENT AND WORLD RX TO WORK ON DEVELOPING THE NEXT GENERATION OF RALLYCROSS TRACKS,"Following the news that Volvo Construction Equipment (Volvo CE) has become the Official Construction Equipment Supplier to the new fully electric FIA World Rallycross Championship (World RX), Volvo CE today announces that it will expand its involvement – becoming the Series’ Official Track Build Partner’.","When Volvo CE commits to something, it goes ‘all in’. So, when asked to support the build of the tracks for the new 680bhp electric cars, the company decided to use its off-road expertise to help World RX in designing and testing a whole new series of track elements that will encourage the racing to be as close as it is thrilling.
WORLD RX TRACKS 2.0
Following a series of workshops on what features make the ‘perfect’ rallycross track, Volvo CE invited the FIA, Race Series organizer Rallycross Promoter GmbH and professional drivers Timmy Hanssen, Klara Andersson and Niclas Grönholm to its specially developed ‘RallyCross Test Lab’ at the GTR racetrack in Eskilstuna, Sweden. Here, Volvo CE has helped test and design jumps, turns and dynamic features to keep the racing electrifyingly close. These included steeply banked turns, chicanes and epic jumps. 

During a three-day test at the Rallycross Test Lab in early May, each track element was closely evaluated, with lots of ideas on how to encourage more overtaking and a greater spectacle for racegoers. The racing experts’ suggested improvements – which were then quickly realized using Volvo CE’s machines, refining each element until it was considered perfect. Once each feature was signed off by the FIA, the build data was captured in 3D on Volvo CE’s Dig Assist in-cab machine control application. These data can then be programmed into Volvo machines and recreated at each of the tracks the race series visits during the coming World Championship. This will not only reduce the build time of each track considerably, but also do it with minimal carbon footprint.
DESIGNED FOR RACERS – BY RACERS
Klara Andersson, driver for the new Construction Equipment Dealer Team, is looking forward to trying out the new tracks
“The new tracks are going to be awesome!” says Klara Andersson, who drives for the new Construction Equipment Dealer Team in the forthcoming championship. “The jumps are epic – the fastest ones we will hit at 100 km/h and fly through the air for 25 meters and more!”

“The new race elements will be thrilling to drive,” agrees Klara’s teammate Niclas Grönholm. “The steep banking means we will be able to drive through turns on full throttle, while other corners are cleverly designed so that there are multiple racing lines – leading to wheel-to-wheel racing and more overtaking.”
NO COMPROMISE CONSTRUCTION
A series of workshops were held to determine the most exciting and efficient track builds.
“Our aim is to create the next generation of thrilling Rallycross circuits in the most effective and sustainable way,” says Arvid Rinaldo, who heads up the partnership and the operational involvement in World RX for Volvo CE. “Our ultimate aim is to support the build and upgrade of tracks with a zero-carbon footprint, but thanks to the use of our electric equipment and latest low-emission engines running on biofuels, even at the outset we hope to significantly reduce the carbon footprint of each track build. It’s the perfect platform for us to demonstrate to our own audiences how we can help transform the construction equipment industry and motorsport to be more sustainable.”

The 2022 FIA World Rallycross Championship season starts at the Höljes circuit in Sweden on July 2-3, with the first race weekend at the legendary Nürburgring in Germany on July 30-31."
By Press information,5/12/2022,https://www.volvoce.com/global/en/news-and-events/press-releases/2022/volvo-ce-boosts-its-electrification-transformation-with-investment-in-dutch-manufacturer-limach/,VOLVO CE BOOSTS ITS ELECTRIFICATION TRANSFORMATION WITH INVESTMENT IN DUTCH MANUFACTURER LIMACH,"As part of its commitment to lead the sustainability transformation and accelerate the shift to electromobility, Volvo Construction Equipment (Volvo CE) has invested in Dutch firm Limach, a manufacturer of electric excavators for the domestic market.","The majority investment in Electric Special Technics B.V - which operates under the brand name Limach - complements Volvo CE’s long-term electrification roadmap and provides the opportunity to swiftly broaden the electromobility portfolio and add to the five electric compact machines currently available, further extending what is already the widest range on the market.
Limach offers customized electric wheeled and crawler excavators to the Dutch market. An innovative company, it applies proven Li-Ion battery technology to develop first-class electrical construction machines using conventional Volvo CE products as a base.
“Climate change is real and we believe collaborating in new ways is key to meet the growing demand for sustainable solutions. As a leader in electric construction solutions, we see Limach as an interesting actor in a progressive market, and a great complement to our existing portfolio of electric machines, meaning our customers will benefit from a broader range to suit their requirements.
“Working together, and with our combined customer base, opens opportunities for co-learning and expanding experiences of these types of solutions, as we continue driving the transformation towards sustainable power sources,” says Thomas Bitter, Head of Technology at Volvo CE.
The current range extends from the compact E18.3 electric mini excavator with an operating range of 1,810kg to the E140.1, which packs an operating weight of over 14,000 kg and complements Volvo CE’s existing range of electric machines. Together, they offer customers a variety of solutions to meet their emission reduction ambitions, says Henri de Groot, CTO at Limach
The internal combustion engine on select excavators will be replaced by a Limach developed electrification kit.
Rens de Bruijn, CEO at Limach, says: “Limach was established with the purpose to develop construction equipment with an electric drive. Each machine is custom-made at our production facility in Ede in the Netherlands and delivered according to customer specifications. Since the development of our first demonstrator excavator in 2017, we have seen growing demand from customers in the Netherlands. Thanks to the investment from Volvo CE, we can scale-up production of our electric excavators and extend the range we offer to meet this growing appetite for electric drives.”
Limach will continue to operate as a standalone company. The transaction is not expected to have a significant impact on the Volvo Group’s earnings or financial position."
By Press information,4/22/2022,https://www.volvoce.com/global/en/news-and-events/press-releases/2022/volvo-ce-steady-q1-performance-impacted-by-china/,VOLVO CE’S STEADY Q1 PERFORMANCE IMPACTED BY CHINA,"Volvo Construction Equipment (Volvo CE) saw a modest increase in net sales for Q1, 2022 in all areas outside of Asia – with its overall growth momentum impacted by the market decline in China, triggered in part by the ongoing Covid-19 restrictions there.","The ongoing pandemic in China has had a significant impact on sales in the construction equipment industry’s largest market in the world, leading to a drop of 9% in overall global sales for the first quarter of 2022. However, all other regions have played a strong role in softening the impact by demonstrating a steady increase in sales for the first three months of the year, with South America reporting the highest increase of 62%, North America rising 11%, Africa and Oceania 5% and Europe 2%. Further illustrating the escalating importance of service solutions, service sales have also increased by 17%.

Melker Jernberg, President of Volvo CE, says: “There can be no doubt that the industry and the wider world itself is in the midst of extremely challenging times, but I am proud that we as an organization are tackling these issues head on – supplying our customers with the products and services they need today, while focusing on the tragic humanitarian crises going on around the globe and taking action on urgent climate change. During this difficult period, we are keeping up the speed of transformation to more sustainable construction and infrastructure solutions, helping to decarbonize value chains, all the while safeguarding our communities around the world.”

During Q1 2022, Volvo CE saw net sales decrease to SEK 22,613 M from SEK 24,742 M in Q1, 2021. Adjusted operating income amounted to SEK 2,810 M (SEK 3,822 M in Q1, 2021), corresponding to an adjusted operating margin of 12.4%, down from 15.4%. The operating income has been negatively affected by lower machine volumes and higher material costs, which were partially mitigated by improved price realization and higher service volumes. 

The elevated levels of order intake from the same period last year as the world recovered somewhat from the impact of the pandemic, has meant there has been a drop in order intake for Q1, 2022 – declining by 42%. While mainly due to the continued decline in China, order intake has also felt the effect of a cancellation of orders in Russia and restrictive order slotting due to large order books. Effects from a strained supply chain have also led to deliveries decreasing by 33%.
MARKET DEVELOPMENT
The European market grew by 13% in the first two months of the year, influenced by a large number of investments in infrastructure and housing, while North America increased by 20% thanks to the high levels of housing construction and manufacturing in the region. Due to the strong demand for commodities, South America has continued its robust rise in market demand with a 45% increase on the same quarter last year. However, all of this has been affected by a 33% decline in the Chinese market, primarily due to a spike in Covid-19 cases that has led to restrictions and lockdowns across the country, but also due to a price pressure that remains primarily on excavators. Asia outside of China has also been negatively impacted by price increases on machines in India, related to new emission regulations, and has reported an 8% fall.

Volvo CE is demonstrating a solid performance during challenging times, while also continuing its evolution as a sustainable leader, not just for the company but for the industry and society as a whole. This quarter marks the successful launch of its first fully electric machine in the Asian market – the ECR25 Electric compact excavator – now available for customers to buy in South Korea and the introduction of a tailored CO2 Reduction Program aimed at helping customers realize their own unique goals towards carbon neutrality.

Table 1. Volvo Construction Equipment, net sales by market area, in Millions of Swedish Krona"
By Press information,4/19/2022,https://www.volvoce.com/global/en/news-and-events/press-releases/2022/volvo-construction-equipment-carl-slotte-change-starts-here/,CHANGE STARTS HERE - A CALL FOR ACTION,"“If I were an adult, I would care for the environment a lot more than grown-ups do today - we need to make the world better! I worry that one day I might not be able to play in the forest anymore.” These words from seven-year-old Siri Riutta echo the concerns of millions of children across the world.","Like Siri, caring for the environment comes natural for the younger generation. Their call for action to the older generation, that today holds the power to decide how to combat climate change, is real and at Volvo Construction Equipment (Volvo CE) we listen and acknowledge the vital role we have to play to drive the change needed. What’s more, we owe it to Siri and to future generations. We are probably the last generation that can make a real difference and build the world we want to live in, rather than the world we are left with.
Carl Slotte, Head of Sales Region Europe, comments on the need for change. “First of all, I am extremely proud to work for a company, like Volvo CE, that has ambitious and concrete sustainability goals. As one of the leading companies in our industry we have a responsibility, and we take it. Our climate targets are clear: from 2040 we shall have 100% fossil fuel free vehicles across the Volvo Group and reach net zero value chain greenhouse gas emissions.”
As an enabler and platform to drive the message of change, Volvo CE is today launching the new marketing campaign, ‘Change Starts Here’. This new marketing approach has two main purposes. The first is to take the lead in driving change within the very important areas of sustainability, electromobility and services and to encourage all our stakeholders to join to take action. And the other is to demonstrate to customers how we are transforming our industry through our offering within these three key areas – and to do so while giving them an equally good experience of these messages no matter if they engage through a virtual or physical platform. That is what the omnichannel approach is about.
Last year, Volvo CE announced its intentions to adopt a new omnichannel marketing approach that will allow us to connect with our customers, dealers and other stakeholders via a mix of virtual and physical events. Whilst the challenges we face require us to work more closely and collaboratively, it is just not practical or sustainable for this to be all in-person. So, we are soon launching an exciting new virtual platform and offering our stakeholders choice in how they interact with us. Volvo Days, our flagship customer relationship building event in Eskilstuna, Sweden in June, will, for example, have a new look and feel, with both physical and virtual options to join us and experience what we have to offer. Digital and physical experiences connected in a way not done before – coupled with the red thread of sustainability, electromobility and services.
Carl Slotte
Sustainability is the overarching umbrella for our strategic agenda where clearly defined science-based targets make the foundation for our future development. Electrification is one key to drive a fossil-free industry going forward and Volvo CE is today offering the widest range of electric compact machines on the market and has a clear pathway to grow and extend our electric offering, from compact machines to heavy equipment. Another proof point of our commitment to drive electrification in partnership is the cooperation with the FIA World Rallycross Championship, which gives us a global platform to demonstrate the potential of electric power across industries.
With our services, we have an opportunity to help customers maximize the productivity and efficiencies of their worksites. Our recently launched CO₂ Reduction Program, for example, is just one way we are looking to help customers tackle their carbon footprints and we are continuing to evolve the services and solutions we offer.
We have a real opportunity to make a difference together, and to build the world we want to live in; for us, for Siri and the future generations, customers, suppliers, policymakers. Let´s do this together! Change Starts Here."
By Press information,4/12/2022,https://www.volvoce.com/global/en/news-and-events/press-releases/2022/volvo-construction-equipment-enters-partnership-with-fia/,VOLVO CONSTRUCTION EQUIPMENT ENTERS PARTNERSHIP WITH FIA,"Demonstrating the potential of electric power on a global stage, Volvo Construction Equipment (Volvo CE) will become the Official Construction Equipment Supplier to the new fully electric FIA World Rallycross Championship (World RX).","• Volvo Construction Equipment signs three-year agreement to become official supplier to inaugural fully electric FIA World Rallycross Championship
• The championship will be held in iconic locations from July to the end of 2022, expanding to additional markets in subsequent seasons
• Establishes a multi-stakeholder engagement platform to accelerate sustainable transformation in the construction equipment industry and motorsport
A PARTNERSHIP TO ACCELERATE TRANSFORMATION
The three-year partnership will see Volvo CE put to work a mix of its industry-leading electric construction equipment and its most sustainable and innovative solutions in the exciting world of motorsport as the FIA World Rallycross Championship now enters a completely new era of fully electric racing. Further exciting details about the pioneering partnership will be revealed over the coming weeks.

World RX has always been a spectator-friendly race series that sees production-based cars race on short, closed circuits on asphalt and gravel. Now for the first time, the championship is being reinvented for 2022 as a fully electric series – as it targets a younger, more diverse audience. 

Arne Dirks, Executive Director of World RX, says: “We are very proud to announce Volvo CE as our Official Construction Equipment Supplier. They are a great partner for World RX, and they join us at a seminal moment as the World Championship goes electric. Not only do we share similar goals with regard to sustainability, but Volvo CE will be working with us on some hugely exciting top-secret projects that we will be able to confirm shortly and which we are confident will kick-start rallycross’ new era in sensational style.”
CHANGE STARTS HERE
Volvo CE intends to use its involvement in the championship to push the boundaries for sustainability, safety, equality, and diversity. Like the rallycross cars themselves, Volvo CE has a track-record of delivering high performance off-road solutions – and will use the international electric race series as a platform to showcase its growing range of electric construction equipment and innovative services to a global audience. 

Bill Law, Head of Brand, Marketing & Communications at Volvo CE, says: “A global shift to an electric future is inevitable and urgent – and we know that more sustainable construction solutions are a vital part of driving that change. That is why we are thrilled to partner with the now fully electric FIA World Rallycross Championship – a series that shares our commitment to not only demonstrate the power of electromobility today, but also work together on a journey to build the world we want to live in.”
EXCITING JOURNEY AHEAD
The season will begin with a ‘Launch Event’ at iconic Swedish circuit Höljes, before travelling to Germany’s famous Nürburgring, Hell in Norway, Riga in Latvia, Montalegre in Portugal, Spa-Francorchamps in Belgium and one additional venue still to be announced. 
SUSTAINABLE AND DIGITAL
As part of a shared sustainability roadmap, the parties will aim to limit transportation and logistics’ emissions at the races, boost inclusivity and reduce travel-related emissions. Volvo CE will engage principally local customers to attend races and roadshows, with digital tools including the championship’s RX+ livestreaming platform allowing a wider audience to enjoy the races virtually.
“The integration of the physical event and the digital experience makes World RX a good fit into our new marketing approach, reflecting evolving ways to reach all our stakeholders in an engaging and exciting way,” says Bill Law, Head of Brand, Marketing & Communications at Volvo CE."
By Press information,4/1/2022,https://www.volvoce.com/global/en/news-and-events/press-releases/2022/volvo-ce-offers-tailored-support-for-customers-to-reach-carbon-reduction-goals/,VOLVO CE OFFERS TAILORED SUPPORT FOR CUSTOMERS TO REACH CARBON REDUCTION GOALS,"Creating a carbon-free future is only possible through collaboration. In a shared commitment to reduce its environmental impact, Volvo Construction Equipment (Volvo CE) is making it easier for customers to reach their own carbon reduction goals with personalized plans.","Taking advantage of the breadth of its existing solutions and services, Volvo CE has developed a step-by-step approach with the CO2 Reduction Program to help customers realize their own unique goals towards carbon neutrality. There is no one-size-fits-all solution and every customer’s business is different, which is why these tailored solutions offer a practical way to make significant improvements to how machines are used on site today and in the future.
Niklas Nillroth, Head of Sustainability and Public Affairs at Volvo CE, says: “Climate change is one of the biggest challenges of our time, and one of the most important actions we can take is to help reduce our customers’ emissions. It is vital to get everyone involved and make it easy to contribute as part of one’s daily work. Every step on the path to net zero counts.”
“The services we use have been built on decades of innovation here at Volvo CE, but now for the first time we are bringing them together in one cohesive program that can be individually tailored to best fit our customers’ needs.”
CO2 REDUCTION IN FOUR STEPS
The CO2 Reduction Program is designed to be easily integrated into customer’s plans, while maintaining required levels of profitability and productivity, and is based on four simple steps:
Insights – Volvo CE starts by understanding where the customer currently is in terms of carbon emissions and establishing a baseline to compare against. Using telematics data from connected machines, Volvo CE determines the CO2 footprint for all machines on site – no matter the brand. Mapping this data then allows the customer to visualize the impact of carbon reduction changes over time.
Analyze – The experts at Volvo CE analyze the customer’s machine data and conduct a site study to understand how the material flow, fleet composition, and operator behavior affects the emissions on their site(s). Volvo CE then illustrates where improvements can be made and what actions need to be taken to reduce CO2 /ton. Using Volvo Site Simulation, the experts reveal to the customer the impact of these improvements to help motivate real change.
Improve – After identifying the specific actions required, Volvo CE helps the customer to implement them. This will vary from customer to customer, but Volvo CE is there to support with key services such as Eco Operator training and other efficiency services such as Efficient Load Out – or plan a smooth transition towards electric machines.
Sustain – At this stage the customer will already start seeing the rewards of their efforts, both economically and environmentally. However, the final step is for Volvo CE to support in sustaining these efforts, by continuously monitoring the CO2 level over time, to make sure that the improvements reduce emissions and customers do not slip back into old habits. Volvo CE will also look for new ways to reduce emissions even further in the future.
LEADING THE WAY. TOGETHER.
This customer program is one of many initiatives devised by Volvo CE towards the needed transformation within the construction industry. The company has set an industry-leading target to reach net zero value chain greenhouse gas emissions by 2040 – with a 50% reduction in CO2 emissions across its own operations and a 30% reduction in CO2 emissions across product use as early as 2030.
In 2013, Volvo CE introduced the world’s first carbon neutral construction equipment production facility in Braås, Sweden – which recently built the world’s first vehicle made of fossil-free steel - and in addition currently offers the largest range of electric machines.
Volvo CE encourages customers to find out how they can elevate their efforts to reach net zero or take the first step on their sustainability journey today by contacting their local dealer or visiting the Volvo CO2 Reduction Program."
