뉴스구분,날짜,링크,제목,요약,본문
By Press Information,3/16/2021,https://www.volvoce.com/global/en/news-and-events/press-releases/2021/volvo-ce-sells-a-million-machines-in-one-year/,VOLVO CE SELLS A MILLION MACHINES IN ONE YEAR – ITS FASTEST YET FOR A NEW SERIES,"… a new series of toys that is. Volvo Construction Equipment (Volvo CE) has secured its position as one of the most beloved branded toys, thanks to a gamechanging partnership with toymaker Dickie Toys.","Volvo CE released to the market its biggest ever range of toy excavators, loaders, haulers and trucks – and even a fictional wrecking ball – in collaboration with German toymaker Dickie Toys last year. The partnership, which ensured Volvo’s presence in almost every major toy store, has had a flying start, despite the obvious challenges for the retail industry posed by Covid-19, with well over a million products sold in the last 12 months.
  The collaboration represents a unique point in Volvo CE’s licensing journey, following on the heels of successful partnerships with toymakers LEGO® Technic and Bruder, among others, and marking the company’s first venture into fully-immersive play sets for all the ages. It is also the most comprehensive collaboration across the Group, with machines from not only Volvo CE, but also Volvo Trucks and Mack Trucks.
  The toy range marks a successful collaboration between Volvo CE, Volvo Trucks, Mack Trucks and of course Dickie Toys (picture taken at the beginning of the collaboration)
Tim Birks, Merchandise and Licensing Manager, at Volvo CE, says: “Dickie Toys was a natural choice. We share the same core values, we are aligned in our desire for good quality products and we have always been impressed with the ‘feel-good factor’ of their toys. And it’s been comforting to know that these toys have played an important role in keeping children around the world entertained and engaged during some of the hardest months of the pandemic.”
  Family-owned Dickie Toys is a German-based manufacturer and part of the larger Simba Dickie Group, which is one of the top five toy manufacturers in Europe.
  A close relationship between teams across the two brands has ensured a deep consideration for the Volvo identity. By creating ‘real-life’ play sets, as well as individual toys, the partnership aims to inspire imaginative play. 
  “We are delighted about our fruitful and trustful cooperation with Volvo. Children are fascinated by huge construction vehicles, such as from Volvo with its technical expertise. Dickie Toys accompanies children through all stages of their development, therefore Volvo is predestined for our toys range,” says Oliver Naumann, Managing Director of Dickie Toys. “The products are very well received by the consumers and are very successful at the point of sale, as well as on and offline.“
  To get your hands on one of these mini machines please visit https://www.merchandise.volvoce.com/ or www.dickietoys.de. 
 "
By Press information,3/5/2021,https://www.volvoce.com/global/en/news-and-events/press-releases/2021/volvo-l25-electric-gives-winter-the-cold-shoulder-with-eco-friendly-city-cleaning/,VOLVO L25 ELECTRIC GIVES WINTER THE COLD SHOULDER WITH ECO-FRIENDLY CITY CLEANING,"The first electric compact wheel loader from Volvo Construction Equipment (Volvo CE) – the Volvo L25 Electric – has been proving it can weather any storm by helping to keep the icy streets of Cologne, Germany, clean and clear during the long cold winter.","The responsibility for keeping Cologne, Germany’s fourth largest city, looking its best falls to AWB Abfallwirtschaftsbetriebe Cologne GmbH. Its vital work in street cleaning and waste disposal ensure that not only is this cathedral city kept clean and safe, but that the surrounding Rhine area and its network of highways are kept open and safe for travellers all over the region. Around 700 employees are on hand to keep some 2,000 km of main road, 600 km of access road and 500 km of residential street free from snow and ice.
ZERO DEGREES, ZERO EMISSIONS
For such a substantial task during the most challenging months of the year, AWB needed a partner that could play a vital role in its operations – one that could not only work with power and performance no matter the conditions, but also one that would limit its environmental impact with zero emissions. Which is why AWB chose the L25 Electric, through Volvo partner and dealership Swecon Baumaschinenen GmbH, to help in keeping its winter service provision moving from its new depot in the heart of the city. As well as being reliable, efficient and good value for money, the electric wheel loader was picked for the task because it produces zero exhaust fumes, low noise and low vibrations, making it an ideal solution for work inside a depot, without the need for a ventilation system.
The L25 Electric is working inside AWB’s depot handling the transportation of grit for the city’s streets
Sustainability has been a core objective at AWB for some time and the company is recognized as a pioneer of environmentally responsible initiatives within its industry. In addition, the company regards itself as a partner to the City of Cologne and is committed to continuously improving the quality of life for its citzens. As such, care is always taken to only employ vehicles and machines that are low emission.
“The wheel loader is an important milestone in our journey to introduce more electric mobility at AWB Cologne and is certainly fulfilling our expectations,” says Dr. Bert Schröer, Head of Mobility and Sustainability at AWB Cologne. “We are managing well with the electric power – even in the cold. Capacity, handling and shovel size – everything fits. So far, there have been no aspects that would make us question our decision. It was definitely the right choice.”
The machine's zero emissions, low noise and low vibrations are ideal for work inside the depot
A MACHINE WITH THE GRIT TO SUCCEED
As the first Volvo L25 Electric to be delivered to a job site in Germany, it has aleady proved a success since it started work back in December. And this new addition to the fleet has an important role to play. Its main task within the 1,700 sq m depot is to feed the screw conveyor which transports the material to the silos, which in turn fills AWB’s grit spreaders. “If the wheel loader doesn’t transport the grit to the silos, then there would be no grit on the streets of Cologne,” comments Schröer. “Maximum reliability and availability are therefore an absolute must.”
As the wheel loader is in continuous operation over three shifts throughout the winter service period, a four-year service agreement was signed. This includes the maintenance of the machine and its components. Fast charging infrastructure was developed at AWB’s depot to enable the L25 Electric to work independently. Swecon places great importance on training its employees, especially to aid in the transition towards electric construction machines, so that they can provide the best possible service to its customers. 
During the summer months, the L25 Electric will still be in demand when it is deployed as an 'allround loader', providing support for AWB's transport works across its 36,000 sq m territory, such as transporting arboreal waste to loading a variety of bulky goods."
By Press Information,3/1/2021,https://www.volvoce.com/global/en/news-and-events/press-releases/2021/volvo-ce-to-open-new-test-and-demo-area/,"VOLVO CE TO OPEN NEW TEST AND DEMO AREA DEDICATED TO SUSTAINABLE POWER, CONNECTIVITY AND AUTONOMOUS SOLUTIONS","Volvo Construction Equipment (Volvo CE) is distinguishing itself in the construction equipment industry by building the world’s first test and demonstration area for electric autonomous transport solutions at its Customer Center in Eskilstuna, Sweden.","Construction has already begun on a brand-new area at the Volvo CE Customer Center in Eskilstuna, Sweden, dedicated to testing and demonstrating the latest innovations in sustainable power, connectivity and autonomous solutions. 

This 66,000m2 innovation zone will include a secure track for full-electric, automated and teleoperated machines with charging infrastructures and 5G connectivity, a control and training room building, a spectator stand and training area for the Volvo Co-Pilot assist functions.

Chief among the innovations on display will be the TARA autonomous transport solution from Volvo Autonomous Solutions for defined sites, such as quarries or mines. 

“We are excited to demonstrate our complete TARA solution to customers, including how to set up and run the site, how to charge and store the TA15 electric autonomous haulers, and how we manage the control room and surveillance operations – everything in a brand new state-of-the-art facility” explains Calle Skillsäter, technical specialist in connected machines at Volvo Autonomous Solutions.

The secure track will also showcase remote-controlled machines, which are likewise ideal for working in quarries or mines, using two teleoperation rigs installed in one of the control rooms. Another of the control rooms, meanwhile, will demonstrate in real time how the company’s uptime and productivity services can reduce customers’ total cost of ownership and operation.

“This is an important strategic investment, not just for Volvo CE and Volvo Autonomous Solutions but the entire Volvo Group – and is proof of our commitment to drive sustainability through innovation. We are looking forward to welcoming visitors to this world-class facility and allowing them to experience exactly how we are building tomorrow,” says Carl Slotte, Head of Sales Region Europe & International at Volvo CE. 

The new innovation area is expected to open by autumn 2021 at the latest."
By Press Information,2/3/2021,https://www.volvoce.com/global/en/news-and-events/press-releases/2021/sales-up-6-in-volvo-construction-equipment-4th-quarter-2020/,SALES UP 6% IN VOLVO CONSTRUCTION EQUIPMENT'S 4TH QUARTER 2020,"Improved activity in most markets saw sales increase by 6% in the fourth quarter 2020, while the order book was up by 31%. ","Despite a steep drop in demand in the first half of the year due to the Covid-19 pandemic, Volvo Construction Equipment (Volvo CE) recovered well, delivering improvements in sales and operating income in the fourth quarter 2020.
In Q4 2020, net sales increased by 6% to SEK 20,810 M (19,716). Adjusted for currency movements net sales were up by 15%. Operating income amounted to SEK 2,321 M (1,931), corresponding to an operating margin of 11.2% (9.8). Earnings were positively impacted by higher machine and service sales.
For the full year net sales decreased by 8%, to SEK 81,453 M (88,606). Adjusted operating income decreased to SEK 10,071 M (11,910), corresponding to an operating margin of 12.4% (13.4).
MARKET CONDITIONS
After a steep drop at the start of the pandemic in the spring, demand started to recover in the second half of the year. Up to November both the European and North American markets were down 14%, while South America rose 12%, largely a result of an improving Brazilian market. Government stimulus measures fueled a sharp recovery in China, which was up 28%, although Asia as a whole was down by 6%. 
ORDERS AND DELIVERIES
During the fourth quarter of 2020 Volvo CE saw net order intake increase by 31%, driven by improving activity in most markets and dealer restocking. Order intake in Europe increased by 20% but fell (compared to the record order intake in 2019) by 18% in North America. In South America order intake was up 182%, up from low levels in most markets. In Asia order intake was up 39%, boosted by government stimulus in China and improvements in other markets.
Deliveries increased by 21% during the fourth quarter 2020, again boosted by higher volumes in China, as well as other Asian markets and Brazil.
“In 2020 the global pandemic presented us with challenges that are unprecedented in modern times,” says Melker Jernberg, president of Volvo Construction Equipment. “But together with business partners and suppliers we were able to support customers through all stages of the crisis. Construction activity is now back on a par with pre-pandemic levels, and this is giving confidence to customers, which is visible in our strong order intake.”

In the fourth quarter Volvo CE began deliveries of its electric compact wheel loaders and compact excavators, beginning the company’s electrification journey.
Net sales by market area  Fourth quarter Full year
SEK M  2020 2019 2020 2019
Europe  6,038 6,791  23,191 30,300
North America  2,814 3,300 13,020 17,404
South America  742 617 2,245 2,532
Asia  9,978 7,930 39,095 33,932
Africa and Oceania  1,239 1,078 3,902 4,437
Total  20,810 19,716 81,453 88,606"
By Press Information,1/20/2021,https://www.volvoce.com/global/en/news-and-events/press-releases/2021/first-customers-to-order-volvo-electric-compact-machines-at-bauma-2019-take-delivery/,FIRST CUSTOMERS TO ORDER VOLVO ELECTRIC COMPACT MACHINES AT BAUMA 2019 TAKE DELIVERY,"K Baugerød Anlegg and Veidekke of Norway, the first companies to place an order for the new Volvo ECR25 Electric compact excavator and Volvo L25 Electric compact wheel loader from Volvo Construction Equipment at Bauma 2019, have now received their machines.","Volvo Construction Equipment (Volvo CE) and its local dealer Volvo Maskin are celebrating an important milestone in Norway’s long-term journey towards electrification and a more sustainable infrastructure. 

This week, longstanding customers K Baugerød Anlegg and Veidekke took delivery of the first electric construction machines in the country – a Volvo ECR25 Electric compact excavator and a Volvo L25 Electric wheel loader.

K Baugerød Anlegg and Veidekke were among the first customers in the world to place an order for these groundbreaking new models during their global launch at the Bauma exhibition in Munich, Germany, in 2019. In signing the contracts, Volvo CE, K Baugerød Anlegg and Veidekke committed to building a sustainable future together.

K Baugerød Anlegg plans to deploy the Volvo ECR25 Electric for its work with cable and pipeline construction in the city of Oslo City, while Veidekke will first use the Volvo L25 Electric in a job for the Norwegian Public Roads Administration. 
QUIET, EMISSION FREE OPERATION
“Our clients request more environmentally friendly solutions, and we want to be in the forefront. The new quiet and emission-free excavator will also make an immediate difference to the quality of life to the operator and other staff on site,” said Sara Iselin Nysveen Bakke, general manager at K Baugerød Anlegg.

Are Ellefsrud, machine manager at Veidekke added: “We are proud to be among the first construction companies in Norway to operate a Volvo electric machine and demonstrate to our customers and wider society that we take our role in caring for the environment and combatting climate change very seriously.”
Are Ellefsrud, Veidekke and Kenneth Hansen, Volvo Maskin Norway

Replacing a combustion engine with 48-volt lithium ion batteries and electric motors, these machines offer the same high performance customers expect from Volvo CE, but with zero emissions, low noise, less vibration and simpler maintenance requirements. The batteries store enough energy to power an eight-hour shift in typical applications, such as landscaping and utility work, and can be charged overnight via a regular household plug socket.
COLLABORATION FOR A FOSSIL-FREE FUTURE
At a socially-distanced handover event to comply with local COVID-19 restrictions, David Kristianslund, sales director at Volvo Maskin, thanked K Baugerød Anlegg and Veidekke for their collaboration. 

“We would like to thank K Baugerød Anlegg and Veidekke for the trust they have placed in us and are proud to work with them as the first owners of the Volvo ECR25 Electric and Volvo L25 Electric in Norway, pioneering a better and more sustainable future,” he said.

Volvo CE President Melker Jernberg also sent a digital message to the leaders of K Baugerød Anlegg and Veidekke. “The support and commitment of forward-thinking and environmentally conscious customers, such as K Baugerød Anlegg and Veidekke is essential for the development of sustainable infrastructure solutions. By working closely together, we can all learn faster and accelerate the transition to a fossil-free future and help build the world we want to live in,” he concluded.
 "
By Press Information,12/17/2020,https://www.volvoce.com/global/en/news-and-events/press-releases/2020/volvo-ce-and-volvo-trucks-customer-deliveries-of-all-electric-products/,VOLVO CE AND VOLVO TRUCKS CUSTOMER DELIVERIES OF ALL-ELECTRIC PRODUCTS,"Launching a new generation of zero exhaust emissions products, leading French contractor Eiffage has taken delivery of an all-electric Volvo FE Electric truck and a Volvo ECR25 Electric compact excavator – becoming the first recipient of the products in France.","The 17th December saw the first delivery of a Volvo Construction Equipment (Volvo CE) machine and the first all-electric Volvo FE truck in France, thereby accelerate the long-term transformation to more sustainable transport and infrastructure solutions. 

The recipient of the new products – an electric Volvo FE truck, with electrically powered crane, and a Volvo ECR25 Electric compact excavator – was leading French contractor and long-term Volvo customer Eiffage. The machines support Eiffage’s low carbon strategy and are to work on the ambitious Grand Paris Express transport project in the French capital. This is a rapid transit initiative being built in the French capital that will add 200 kilometres (120 mi) of new track and 68 new stations, ultimately serving two million passengers a day. 

The handover of Volvo Trucks and Volvo Construction Equipment’s first all-electric products was marked with a small ceremony in Paris. It was attended by Benoit de Ruffray, Eiffage Group CEO, and representative of Volvo Truck and Volvo CE’s France-based teams. Due to COVID-19 travel restrictions, Volvo Group CEO Martin Lundstedt, Volvo CE President Melker Jernberg and Volvo Trucks President Roger Alm participated digitally. 

“By 2030, we want over a third of the machines the Volvo Group sells to be electric. We can’t do this alone, we want to do this together with our customers, partners like Eiffage and the wider society,” says Volvo Group CEO, Martin Lundstedt. “Today is an exciting landmark on this journey to shape the future of transport and infrastructure.”

“Today’s deliveries of this electric truck and construction machine is the start of a revolution in transport and infrastructure solutions,” agrees Melker Jernberg, President of Volvo CE. “Make no mistake, electric machines are not going to remain a niche product area. Over the course of the next years and decades they will become the dominant source of low-or-no emission power. When coupled with clean energy, their potential to support climate change goals, improve air quality and help build the world we all want to live in cannot be underestimated. I’m very pleased that we are starting this journey with friends such as Eiffage.” 

“The support from forward-thinking customers like Eiffage is important for the future development of sustainable transport solutions. Keeping a close dialogue with customers means that we all learn faster and together can accelerate the necessary transition into a fossil-free future,"" says Roger Alm, President of Volvo Trucks.

This first delivery in France represents, for both Volvo CE and Volvo Trucks, an important and real step on the way to zero emissions. Thanks to their low noise and vibration levels, and their absence of exhaust gases, electric trucks and machines are well suited to meeting tough environmental regulation in urban areas, confined spaces, or specific works. They offer new opportunities for urbanization as well as road infrastructures.

The Volvo FE Electric 6X2 truck was built at the Volvo plant of Blainville sur Orne in France. It will be used to deliver and collect tools and spare parts for demolition works of Part 1 – line 16 and Part T2B of line 15 of the Grand Paris Express project. It will do around 150 km per day – all of them with zero exhaust emissions.

The Volvo ECR25 Electric compact excavator, will be used by Eiffage in support of demolition and dismantling activities, again with zero CO2 emissions and far lower noise and vibration levels than traditional diesel engine machines. The 2.5-ton machine has the same performance as its diesel counterpart, and its battery pack offers four hours work time, depending on application. The Volvo ECR25 Electric was developed and built at Volvo CE’s Belley factory in France."
By Press Information,12/7/2020,https://www.volvoce.com/global/en/news-and-events/press-releases/2020/pioneering-electro-hydraulic-solution-significantly-improving-fuel-efficiency-in-construction-equipm/,PIONEERING ELECTRO-HYDRAULIC SOLUTION SIGNIFICANTLY IMPROVING FUEL EFFICIENCY IN CONSTRUCTION EQUIPMENT,"Volvo Construction Equipment and Finland’s Norrhydro have developed a digital hydraulic actuator that increases productivity while radically cutting fuel bills and CO2 emissions in construction applications. If widely adopted, it could help the industry meet its sustainability ambitions while at the same time improving machine performance.","Volvo Construction Equipment (Volvo CE) is committed to a sustainable future – achieved through internal developments and external partnerships. As part of this strategy Volvo CE, in cooperation with Finland’s Norrhydro, is developing a new technology that is set to revolutionize machine hydraulic performance. When commercialized, the potential customer and climate benefits are expected to be radical, with machine fuel efficiency significantly increased and CO2 emissions being cut. 

While the full details of the revolutionary technology are closely guarded, the Norrhydro patented system, NorrDigiTM, uses a multi-chamber digital hydraulic actuator that improves system efficiency that much of a machine’s hydraulic system can be discarded or downsized. It removes the need for a main control valve – the heart of a traditional hydraulic system – along with excessive pump capacity, piping and hoses. It uses less energy and offers the prospect for downsizing the engine capacity. 
‘IT REMOVES THE NEED FOR A MAIN CONTROL VALVE – THE HEART OF A TRADITIONAL HYDRAULIC SYSTEM.’
 
The ongoing validations of the solution have demonstrated both efficiency improvement and an increased machine productivity. With carbon dioxide emissions reduced, it is making a radical cut in the machine’s carbon footprint. Volvo CE and Norrhydro have signed a multi-year agreement where Volvo CE will continue to develop the technology in partnership with Norrhydro, and subsequently aim for first mover advantage. Volvo CE has exclusive rights to its use in its products during the development process.
SMART CYLINDERS 
Unlike traditional cylinders with two chambers – one pushing, one pulling – the digital hydraulic actuator uses four chambers that can be connected in up to 16 different permutations, depending on the load required by the desired operation. “It’s a bit like a 16-speed linear transmission,” says Peter Stambro, Vice President Business Development at Norrhydro. “Multi-chamber cylinders have been around for a while, but what makes our ones exceptional is the way they have been combined with advanced electronic control systems, whose complex algorithms and computational speed allow for instant response, but using only a fraction of the energy for the same machine maneuver or action compared to a traditional system.” 

“This is a prime example of how partnerships with outside experts can accelerate our own sustainability journey through technical innovation,” says Thomas Bitter, Head of Technology at Volvo CE. “In research so far, the system shows greatest benefits in larger machines – in the case of excavators, those 30 tons and above. However, in the future, the technology could also be used in electric machines, where its much greater hydraulic system efficiency would effectively extend the battery life and operating window,” concludes Bitter. 
‘IN ELECTRIC MACHINES….IT WOULD EFFECTIVELY EXTEND THE BATTERY RUN-TIME AND OPERATING WINDOW.’
ENTERING FIELD TEST PHASE
With a Volvo EC300E 30 ton excavator as a test bed, the revolutionary technology has passed its initial proof-of-concept phase and durability tests, and is now moving to a field test period, where prototypes are used in real world applications by selected customer partners. It is forecast that the revolutionary system will be offered on the company’s excavators by 2024 at the latest. 

“The ability to develop this radical technology in partnership with a leading player in the construction equipment industry offers many advantages, including accelerating the time to market for commercialized products,” say Yrjö Trög, CEO of Norrhydro. “We will invest in a new multi-million euro world-class manufacturing facility in support of the launch, and I look forward to the market introduction of the NorrDigiTM system together with Volvo CE.,”"
